6816ad9504ea5839aa7eacf3,Land nearly save right student figure write may.,544226,86893.27,2025-05-03 18:58:13,2025-07-01 18:58:13,ATRASADO,SOLICITUD_DESCARGA,SOLICITUD_CARGA,SOLICITUD_CARGA,GS,LQ,LQ,agree,outside,reach,6,1,5,28041,45047,48808,168246,45047,244040,Fill think maintain control wife important political executive.,Whatever get scene all build assume.,Offer sing article couple effort tonight leave.,artist,letter,,exactly,present,push,DISPONIBLE,FUERA_DE_SERVICIO,,DISPONIBLE,FUERA_DE_SERVICIO,DISPONIBLE,8,10,,3,1,9,6816ad9504ea5839aa7ea9d3
6816ad9504ea5839aa7eacf4,Point product debate.,166350,26560.1,2025-05-03 18:58:13,2025-06-08 18:58:13,CANCELADO,SOLICITUD_CARGA,SOLICITUD_CARGA,,GL,CN,,treatment,available,,5,2,,14758,33000,,73790,66000,,Word bad knowledge house modern.,Moment both listen student institution.,,on,total,,,,,FUERA_DE_SERVICIO,EN_MANTENIMIENTO,,,,,8,1,,,,,6816ad9504ea5839aa7ea9d4
6816ad9504ea5839aa7eacf5,Television while computer skill contain maintain.,665511,106258.07,2025-05-03 18:58:13,2025-06-29 18:58:13,ATRASADO,SOLICITUD_CARGA,SOLICITUD_CARGA,SOLICITUD_CARGA,GL,GS,GL,enter,pretty,material,8,6,7,15774,38410,28943,126192,230460,202601,Explain economic someone.,Baby who meet school.,Director find yeah test car fine.,over,save,,hot,husband,lay,FUERA_DE_SERVICIO,EN_MANTENIMIENTO,,FUERA_DE_SERVICIO,FUERA_DE_SERVICIO,EN_USO,2,1,,8,10,5,6816ad9504ea5839aa7ea9d5
6816ad9504ea5839aa7eacf6,Year within green current.,587008,93723.96,2025-05-03 18:58:13,2025-06-20 18:58:13,PENDIENTE,SOLICITUD_CARGA,SOLICITUD_DESCARGA,,CG,CN,,girl,money,,3,9,,24385,46681,,73155,420129,,Cover conference both much training.,Call debate successful true.,,throughout,hair,,,society,,FUERA_DE_SERVICIO,DISPONIBLE,,,DISPONIBLE,,10,2,,,8,,6816ad9504ea5839aa7ea9d6
6816ad9504ea5839aa7eacf7,Buy almost speak.,444307,70939.73,2025-05-03 18:58:13,2025-06-20 18:58:13,PAGADA,SOLICITUD_DESCARGA,SOLICITUD_CARGA,SOLICITUD_CARGA,CN,CG,LQ,like,such,open,3,5,3,20209,47104,25740,60627,235520,77220,Boy statement life today difficult tax full.,Heart only mother draw but fine.,Help reach can serious may let including.,structure,our,produce,college,,white,DISPONIBLE,EN_MANTENIMIENTO,EN_USO,DISPONIBLE,,EN_USO,5,8,1,8,,6,6816ad9504ea5839aa7ea9d7
6816ad9504ea5839aa7eacf8,Capital response company actually positive blue professional executive.,374191,59744.74,2025-05-03 18:58:13,2025-06-28 18:58:13,CANCELADO,SOLICITUD_CARGA,SOLICITUD_CARGA,SOLICITUD_DESCARGA,CN,GL,LQ,daughter,role,community,1,4,6,16216,16689,38579,16216,66756,231474,By interview likely moment.,From rise science fight thought price activity stop.,We forward so husband story.,late,ago,,myself,,modern,EN_MANTENIMIENTO,FUERA_DE_SERVICIO,,FUERA_DE_SERVICIO,,EN_USO,2,8,,7,,8,6816ad9504ea5839aa7ea9d8
6816ad9504ea5839aa7eacf9,Fine however fine speech same.,704307,112452.45,2025-05-03 18:58:13,2025-06-16 18:58:13,PAGADA,SOLICITUD_DESCARGA,SOLICITUD_CARGA,SOLICITUD_CARGA,CN,LQ,CN,event,long,build,9,4,7,33067,38234,20188,297603,152936,141316,To read indicate because list choice also feeling.,Analysis same tonight force paper we room up.,Despite brother hear time book hard.,treatment,modern,,night,,,EN_USO,EN_USO,,EN_MANTENIMIENTO,,,8,3,,7,,,6816ad9504ea5839aa7ea9d9
6816ad9504ea5839aa7eacfa,Program few beyond consider political.,397788,63512.44,2025-05-03 18:58:13,2025-06-13 18:58:13,PENDIENTE,SOLICITUD_CARGA,SOLICITUD_DESCARGA,,CN,CN,,our,central,,1,8,,22468,38976,,22468,311808,,Ahead building church success middle all public present.,Card common home least green respond.,,deep,new,,,executive,,EN_MANTENIMIENTO,EN_MANTENIMIENTO,,,DISPONIBLE,,4,2,,,10,,6816ad9504ea5839aa7ea9da
6816ad9504ea5839aa7eacfb,Skill week recently one suggest mind affect.,278172,44414.02,2025-05-03 18:58:13,2025-06-24 18:58:13,PAGADA,SOLICITUD_DESCARGA,SOLICITUD_DESCARGA,SOLICITUD_CARGA,CN,GS,CG,stage,government,tough,4,1,2,46782,23382,11624,187128,23382,23248,Deep sing possible.,Large trip chair plan international three pass.,Join will ask sense spend.,attorney,buy,help,conference,,whether,EN_MANTENIMIENTO,EN_MANTENIMIENTO,DISPONIBLE,EN_MANTENIMIENTO,,EN_USO,4,3,3,5,,7,6816ad9504ea5839aa7ea9db
6816ad9504ea5839aa7eacfc,Nothing kitchen imagine.,384552,61399.07,2025-05-03 18:58:13,2025-06-03 18:58:13,PAGADA,SOLICITUD_DESCARGA,SOLICITUD_CARGA,SOLICITUD_DESCARGA,LQ,RO,CN,already,always,century,5,3,4,19680,17483,43076,98400,52449,172304,Four mean fish same add act.,Pm least culture break.,Prevent law fact.,him,site,deal,so,number,,DISPONIBLE,EN_MANTENIMIENTO,EN_MANTENIMIENTO,DISPONIBLE,FUERA_DE_SERVICIO,,2,3,7,2,8,,6816ad9504ea5839aa7ea9dc
6816ad9504ea5839aa7eacfd,Analysis improve along research.,435916,69600.04,2025-05-03 18:58:13,2025-06-26 18:58:13,PAGADA,SOLICITUD_CARGA,SOLICITUD_DESCARGA,,RO,LQ,,media,personal,,5,8,,42332,19332,,211660,154656,,Story business strong whole.,Size small film wish standard trial.,,red,and,,,,,EN_USO,EN_MANTENIMIENTO,,,,,5,8,,,,,6816ad9504ea5839aa7ea9dd
6816ad9504ea5839aa7eacfe,Avoid project test support personal.,485632,77537.86,2025-05-03 18:58:13,2025-06-16 18:58:13,ATRASADO,SOLICITUD_DESCARGA,SOLICITUD_CARGA,,GL,GS,,us,ahead,,2,9,,11456,42798,,22912,385182,,Serve cold population set full paper.,Type social one could since plan.,,it,model,,,,,DISPONIBLE,DISPONIBLE,,,,,8,5,,,,,6816ad9504ea5839aa7ea9de
6816ad9504ea5839aa7eacff,Treat court community civil price western financial life.,306329,48909.61,2025-05-03 18:58:13,2025-06-08 18:58:13,PENDIENTE,SOLICITUD_DESCARGA,SOLICITUD_CARGA,SOLICITUD_CARGA,CN,GL,RO,head,crime,let,1,8,5,49662,11509,23137,49662,92072,115685,Game race financial ready available support support.,Easy find book natural student thank.,Never ahead important player debate run skin a.,offer,herself,own,cultural,,left,EN_MANTENIMIENTO,FUERA_DE_SERVICIO,EN_MANTENIMIENTO,EN_MANTENIMIENTO,,EN_USO,4,2,4,8,,10,6816ad9504ea5839aa7ea9df
6816ad9504ea5839aa7ead00,Deep forget continue develop keep.,208060,33219.6,2025-05-03 18:58:13,2025-06-24 18:58:13,PAGADA,SOLICITUD_DESCARGA,SOLICITUD_CARGA,SOLICITUD_CARGA,LQ,LQ,RO,safe,operation,discuss,1,3,2,20398,20060,47131,20398,60180,94262,Just big administration already student paper.,Summer join mind leg establish.,Including hand laugh key.,free,morning,,you,authority,,FUERA_DE_SERVICIO,EN_MANTENIMIENTO,,FUERA_DE_SERVICIO,EN_MANTENIMIENTO,,7,3,,7,10,,6816ad9504ea5839aa7ea9e0
6816ad9504ea5839aa7ead01,Individual drop ready wrong instead home.,930653,148591.59,2025-05-03 18:58:13,2025-06-04 18:58:13,CANCELADO,SOLICITUD_CARGA,SOLICITUD_CARGA,SOLICITUD_DESCARGA,GL,GS,CG,Democrat,exist,produce,5,10,6,32839,42298,32481,164195,422980,194886,Far lawyer trial condition physical man anything bag.,Stand evidence cell himself special for though.,Them bad mother worker part.,around,card,Congress,middle,,,DISPONIBLE,FUERA_DE_SERVICIO,DISPONIBLE,DISPONIBLE,,,6,5,6,8,,,6816ad9504ea5839aa7ea9e1
6816ad9504ea5839aa7ead02,Support feel answer dinner town.,228178,36431.74,2025-05-03 18:58:13,2025-06-06 18:58:13,ATRASADO,SOLICITUD_DESCARGA,SOLICITUD_DESCARGA,,GS,CN,,maintain,trouble,,1,5,,48376,28674,,48376,143370,,Third threat race.,Young late reality weight prevent guess tonight.,,or,simply,attorney,,hit,,EN_MANTENIMIENTO,FUERA_DE_SERVICIO,DISPONIBLE,,FUERA_DE_SERVICIO,,6,3,2,,5,,6816ad9504ea5839aa7ea9e2
6816ad9504ea5839aa7ead03,Relationship late pressure eight.,80218,12807.9,2025-05-03 18:58:13,2025-06-28 18:58:13,CANCELADO,SOLICITUD_DESCARGA,,,RO,,,bed,,,2,,,33705,,,67410,,,Financial after cup heart.,,,reach,,,,,,EN_MANTENIMIENTO,,,,,,1,,,,,,6816ad9504ea5839aa7ea9e3
6816ad9504ea5839aa7ead04,Admit form case no research.,117539,18766.68,2025-05-03 18:58:13,2025-06-13 18:58:13,PAGADA,SOLICITUD_DESCARGA,,,GS,,,country,,,3,,,32924,,,98772,,,Community role wrong up.,,,identify,,,,,,EN_USO,,,,,,6,,,,,,6816ad9504ea5839aa7ea9e4
6816ad9504ea5839aa7ead05,Question the leg training say single tend.,185907,29682.56,2025-05-03 18:58:13,2025-06-05 18:58:13,PAGADA,SOLICITUD_DESCARGA,SOLICITUD_CARGA,,GL,CG,,generation,you,,3,4,,14600,28106,,43800,112424,,Laugh career animal religious long matter.,Personal before process both the threat environmental.,,none,girl,hear,,occur,,EN_MANTENIMIENTO,FUERA_DE_SERVICIO,FUERA_DE_SERVICIO,,DISPONIBLE,,4,5,5,,3,,6816ad9504ea5839aa7ea9e5
6816ad9504ea5839aa7ead06,Series participant best against.,159443,25457.34,2025-05-03 18:58:13,2025-06-15 18:58:13,PAGADA,SOLICITUD_DESCARGA,,,CN,,,inside,,,3,,,44662,,,133986,,,System ready may president.,,,issue,,cup,,,,EN_MANTENIMIENTO,,DISPONIBLE,,,,2,,3,,,,6816ad9504ea5839aa7ea9e6
6816ad9504ea5839aa7ead07,Evening season material past dinner huge.,30197,4821.44,2025-05-03 18:58:13,2025-06-08 18:58:13,PENDIENTE,SOLICITUD_CARGA,,,CG,,,structure,,,2,,,12688,,,25376,,,Indicate doctor finally draw those almost door.,,,weight,,good,,,,EN_USO,,EN_USO,,,,6,,4,,,,6816ad9504ea5839aa7ea9e7
6816ad9504ea5839aa7ead08,Better sea child newspaper left fast list.,504869,80609.4,2025-05-03 18:58:13,2025-06-20 18:58:13,PENDIENTE,SOLICITUD_DESCARGA,SOLICITUD_CARGA,,GL,GL,,high,behavior,,9,3,,37841,27897,,340569,83691,,Occur evening wear early month.,Game former after better.,,a,relate,,,,,DISPONIBLE,EN_USO,,,,,2,4,,,,,6816ad9504ea5839aa7ea9e8
6816ad9504ea5839aa7ead09,Environmental doctor ever great family.,418638,66841.43,2025-05-03 18:58:13,2025-06-28 18:58:13,PENDIENTE,SOLICITUD_DESCARGA,SOLICITUD_DESCARGA,SOLICITUD_CARGA,LQ,CG,LQ,pretty,require,big,9,1,4,27141,18520,22252,244269,18520,89008,Born why while newspaper student.,Number use sit party reality around.,Evidence long sort.,investment,some,,such,,,FUERA_DE_SERVICIO,DISPONIBLE,,FUERA_DE_SERVICIO,,,4,8,,8,,,6816ad9504ea5839aa7ea9e9
6816ad9504ea5839aa7ead0a,View onto cell debate can scientist.,67192,10728.16,2025-05-03 18:58:13,2025-06-13 18:58:13,PENDIENTE,SOLICITUD_DESCARGA,,,GS,,,form,,,2,,,28232,,,56464,,,News cover agency arm.,,,arrive,,visit,,,,FUERA_DE_SERVICIO,,FUERA_DE_SERVICIO,,,,1,,9,,,,6816ad9504ea5839aa7ea9ea
6816ad9504ea5839aa7ead0b,Political from weight truth seat bed.,169382,27044.22,2025-05-03 18:58:13,2025-06-19 18:58:13,CANCELADO,SOLICITUD_CARGA,SOLICITUD_CARGA,,GL,RO,,country,as,,3,9,,16171,10425,,48513,93825,,Phone turn detail trouble chance.,Deep really fear service.,,avoid,collection,,,home,,EN_USO,EN_USO,,,EN_USO,,9,7,,,6,,6816ad9504ea5839aa7ea9eb
6816ad9504ea5839aa7ead0c,Radio relate analysis tell lot here.,367420,58663.64,2025-05-03 18:58:13,2025-06-29 18:58:13,CANCELADO,SOLICITUD_CARGA,SOLICITUD_DESCARGA,,RO,CG,,Mrs,remain,,2,5,,33923,48182,,67846,240910,,On method fall front.,Discuss list or among discuss change sound.,,color,them,fine,,,,DISPONIBLE,FUERA_DE_SERVICIO,EN_USO,,,,7,1,9,,,,6816ad9504ea5839aa7ea9ec
6816ad9504ea5839aa7ead0d,Meeting dinner accept whole.,390069,62279.91,2025-05-03 18:58:13,2025-06-25 18:58:13,PENDIENTE,SOLICITUD_DESCARGA,SOLICITUD_CARGA,,CN,RO,,interest,network,,2,7,,17171,41921,,34342,293447,,Project family management street.,Player though another past possible similar eye.,,share,four,,,,,EN_USO,DISPONIBLE,,,,,2,1,,,,,6816ad9504ea5839aa7ea9ed
6816ad9504ea5839aa7ead0e,Find these finish argue stay.,391950,62580.3,2025-05-03 18:58:13,2025-06-24 18:58:13,PAGADA,SOLICITUD_CARGA,SOLICITUD_CARGA,,LQ,LQ,,hundred,program,,4,7,,19073,36154,,76292,253078,,Theory group stay agree where station note.,Yet citizen practice right.,,prove,chance,,,,,EN_MANTENIMIENTO,FUERA_DE_SERVICIO,,,,,5,4,,,,,6816ad9504ea5839aa7ea9ee
6816ad9504ea5839aa7ead0f,Course light food condition their try.,352966,56355.9,2025-05-03 18:58:13,2025-06-19 18:58:13,PENDIENTE,SOLICITUD_CARGA,,,GS,,,real,,,10,,,29661,,,296610,,,Agreement government human exactly best well market own.,,,argue,,,,,,EN_USO,,,,,,4,,,,,,6816ad9504ea5839aa7ea9ef
6816ad9504ea5839aa7ead10,Somebody language else all star week low.,184906,29522.77,2025-05-03 18:58:13,2025-06-12 18:58:13,CANCELADO,SOLICITUD_CARGA,SOLICITUD_DESCARGA,SOLICITUD_DESCARGA,LQ,GL,CG,pay,writer,thousand,5,1,1,20121,39031,15747,100605,39031,15747,Present democratic unit image push drive drop she.,Less Mrs fight attorney.,Meet win white price current quality opportunity.,house,dog,look,environment,,,EN_MANTENIMIENTO,EN_MANTENIMIENTO,FUERA_DE_SERVICIO,EN_USO,,,3,10,3,7,,,6816ad9504ea5839aa7ea9f0
6816ad9504ea5839aa7ead11,Modern modern big remain if newspaper money.,258677,41301.44,2025-05-03 18:58:13,2025-06-13 18:58:13,CANCELADO,SOLICITUD_DESCARGA,SOLICITUD_CARGA,,GS,GS,,behavior,everybody,,10,4,,10586,27879,,105860,111516,,Red family station simply.,Away become six expert.,,discover,his,interesting,,,,EN_USO,EN_USO,DISPONIBLE,,,,1,10,5,,,,6816ad9504ea5839aa7ea9f1
6816ad9504ea5839aa7ead12,Seven think course.,656486,104817.11,2025-05-03 18:58:13,2025-06-11 18:58:13,CANCELADO,SOLICITUD_DESCARGA,SOLICITUD_CARGA,SOLICITUD_DESCARGA,CG,GL,CG,north,economy,sort,8,4,7,35873,41841,13903,286984,167364,97321,Behavior everything laugh rule bar any.,Less baby represent behind prepare.,Product star road everything.,contain,be,,rate,member,,DISPONIBLE,FUERA_DE_SERVICIO,,EN_MANTENIMIENTO,FUERA_DE_SERVICIO,,8,9,,8,1,,6816ad9504ea5839aa7ea9f2
6816ad9504ea5839aa7ead13,Scientist ability phone physical hand view save.,324308,51780.32,2025-05-03 18:58:13,2025-06-13 18:58:13,ATRASADO,SOLICITUD_CARGA,,,LQ,,,notice,,,8,,,34066,,,272528,,,Gun little magazine wide hand tell late role.,,,activity,,,,,,FUERA_DE_SERVICIO,,,,,,5,,,,,,6816ad9504ea5839aa7ea9f3
6816ad9504ea5839aa7ead14,Doctor order prove watch work.,238939,38149.91,2025-05-03 18:58:13,2025-06-30 18:58:13,ATRASADO,SOLICITUD_CARGA,SOLICITUD_CARGA,SOLICITUD_DESCARGA,LQ,RO,CN,long,trial,investment,2,10,1,31022,11715,21595,62044,117150,21595,Meeting executive practice someone.,Debate field similar memory create.,Rock prepare upon.,participant,cut,develop,occur,,ground,DISPONIBLE,EN_USO,DISPONIBLE,EN_USO,,DISPONIBLE,9,9,8,6,,6,6816ad9504ea5839aa7ea9f4
6816ad9504ea5839aa7ead15,Drug baby against down little.,250643,40018.56,2025-05-03 18:58:13,2025-06-08 18:58:13,PENDIENTE,SOLICITUD_CARGA,,,RO,,,trade,,,6,,,35104,,,210624,,,Wide any likely past change option.,,,lose,,hospital,,,,FUERA_DE_SERVICIO,,EN_USO,,,,2,,1,,,,6816ad9504ea5839aa7ea9f5
6816ad9504ea5839aa7ead16,Plant allow there there.,104401,16669.08,2025-05-03 18:58:13,2025-06-11 18:58:13,PENDIENTE,SOLICITUD_DESCARGA,,,GS,,,gun,,,4,,,21933,,,87732,,,Word never include way wall.,,,minute,,,,,,EN_USO,,,,,,7,,,,,,6816ad9504ea5839aa7ea9f6
6816ad9504ea5839aa7ead17,Contain glass campaign four prove dinner.,261443,41743,2025-05-03 18:58:13,2025-06-27 18:58:13,PAGADA,SOLICITUD_CARGA,SOLICITUD_DESCARGA,,GS,RO,,risk,herself,,4,4,,27410,27515,,109640,110060,,Management quality class wonder.,Popular international whether read think.,,believe,size,,,,,DISPONIBLE,EN_USO,,,,,1,4,,,,,6816ad9504ea5839aa7ea9f7
6816ad9504ea5839aa7ead18,Expect around guess information give but.,57765,9222.98,2025-05-03 18:58:13,2025-06-18 18:58:13,CANCELADO,SOLICITUD_CARGA,,,GL,,,cell,,,1,,,48542,,,48542,,,Again skill past together cultural instead hold dinner.,,,include,,fire,,,,EN_MANTENIMIENTO,,DISPONIBLE,,,,2,,2,,,,6816ad9504ea5839aa7ea9f8
6816ad9504ea5839aa7ead19,I better loss turn prove.,434362,69351.9,2025-05-03 18:58:13,2025-06-06 18:58:13,CANCELADO,SOLICITUD_CARGA,SOLICITUD_CARGA,,CN,CG,,song,employee,,10,10,,21260,15241,,212600,152410,,Check inside sell quality.,Generation young into fly.,,interview,tell,house,,concern,,DISPONIBLE,DISPONIBLE,DISPONIBLE,,EN_USO,,2,2,7,,10,,6816ad9504ea5839aa7ea9f9
6816ad9504ea5839aa7ead1a,It ready sea yeah herself resource hope.,173905,27766.41,2025-05-03 18:58:13,2025-06-11 18:58:13,PENDIENTE,SOLICITUD_DESCARGA,,,RO,,,old,,,3,,,48713,,,146139,,,Knowledge operation note feel suggest model yet.,,,method,,feel,,,,EN_USO,,EN_USO,,,,4,,6,,,,6816ad9504ea5839aa7ea9fa
6816ad9504ea5839aa7ead1b,Suggest radio class community interesting.,346733,55360.68,2025-05-03 18:58:13,2025-07-02 18:58:13,CANCELADO,SOLICITUD_CARGA,,,CN,,,point,,,6,,,48562,,,291372,,,Professor hotel first sell answer.,,,report,,the,,,,EN_USO,,DISPONIBLE,,,,4,,9,,,,6816ad9504ea5839aa7ea9fb
6816ad9504ea5839aa7ead1c,Response firm deal process.,405251,64703.93,2025-05-03 18:58:13,2025-06-30 18:58:13,ATRASADO,SOLICITUD_DESCARGA,SOLICITUD_DESCARGA,SOLICITUD_DESCARGA,RO,RO,LQ,order,check,western,1,1,6,28467,15254,49471,28467,15254,296826,Election stop bill new analysis.,West treatment image hit toward.,Agency picture standard box I right western.,trade,major,,money,,,DISPONIBLE,EN_USO,,FUERA_DE_SERVICIO,,,8,8,,4,,,6816ad9504ea5839aa7ea9fc
6816ad9504ea5839aa7ead1d,Team station today wrong machine another ago.,664965,106170.86,2025-05-03 18:58:13,2025-06-15 18:58:13,PENDIENTE,SOLICITUD_CARGA,SOLICITUD_CARGA,SOLICITUD_CARGA,RO,LQ,LQ,material,degree,fund,1,8,8,20986,18956,48270,20986,151648,386160,Green partner practice card low protect again that.,Become test bag popular activity.,Run right side happen need system.,focus,sell,,only,top,level,EN_USO,EN_MANTENIMIENTO,,EN_USO,EN_USO,EN_USO,5,5,,1,9,8,6816ad9504ea5839aa7ea9fd
6816ad9504ea5839aa7ead1e,Behind without gun child nation scene.,295525,47184.6,2025-05-03 18:58:13,2025-06-08 18:58:13,PENDIENTE,SOLICITUD_DESCARGA,SOLICITUD_DESCARGA,,GS,CG,,until,police,,4,2,,38056,48058,,152224,96116,,Tonight yard common inside especially local.,Drug worker cut tough analysis truth.,,simply,analysis,,,,,EN_MANTENIMIENTO,EN_USO,,,,,7,10,,,,,6816ad9504ea5839aa7ea9fe
6816ad9504ea5839aa7ead1f,Policy forward once free result.,298509,47661.12,2025-05-03 18:58:13,2025-06-19 18:58:13,PENDIENTE,SOLICITUD_DESCARGA,,,GL,,,thank,,,8,,,31356,,,250848,,,City black never child.,,,book,,,,,,FUERA_DE_SERVICIO,,,,,,6,,,,,,6816ad9504ea5839aa7ea9ff
6816ad9504ea5839aa7ead20,Shoulder factor mission attorney medical ball.,38020,6070.5,2025-05-03 18:58:13,2025-06-04 18:58:13,ATRASADO,SOLICITUD_DESCARGA,,,CG,,,reason,,,1,,,31950,,,31950,,,It focus walk building.,,,manager,,break,,,,DISPONIBLE,,EN_USO,,,,5,,3,,,,6816ad9504ea5839aa7eaa00
6816ad9504ea5839aa7ead21,Spring western prevent fly mission.,340878,54425.88,2025-05-03 18:58:13,2025-06-26 18:58:13,PAGADA,SOLICITUD_CARGA,,,RO,,,evening,,,9,,,31828,,,286452,,,Fall growth movement.,,,teach,,,,,,DISPONIBLE,,,,,,8,,,,,,6816ad9504ea5839aa7eaa01
6816ad9504ea5839aa7ead22,Toward need marriage.,93771,14971.81,2025-05-03 18:58:13,2025-06-22 18:58:13,PENDIENTE,SOLICITUD_DESCARGA,,,CN,,,raise,,,7,,,11257,,,78799,,,Chair report vote half others democratic agency.,,,television,,,,,,FUERA_DE_SERVICIO,,,,,,3,,,,,,6816ad9504ea5839aa7eaa02
6816ad9504ea5839aa7ead23,Morning to long home lot stuff herself improve.,261449,41743.95,2025-05-03 18:58:13,2025-06-11 18:58:13,PAGADA,SOLICITUD_CARGA,,,RO,,,attention,,,5,,,43941,,,219705,,,Trip management card admit act.,,,through,,,,,,EN_MANTENIMIENTO,,,,,,2,,,,,,6816ad9504ea5839aa7eaa03
6816ad9504ea5839aa7ead24,Act stand you.,841437,134347.1,2025-05-03 18:58:13,2025-06-28 18:58:13,CANCELADO,SOLICITUD_DESCARGA,SOLICITUD_DESCARGA,SOLICITUD_CARGA,RO,CN,CG,woman,city,response,5,5,7,34452,48971,41425,172260,244855,289975,Indeed reduce author family theory commercial.,Outside on something.,Finish remain hear tough side allow.,name,herself,,edge,article,,FUERA_DE_SERVICIO,DISPONIBLE,,EN_USO,FUERA_DE_SERVICIO,,3,4,,5,10,,6816ad9504ea5839aa7eaa04
6816ad9504ea5839aa7ead25,Material east side hotel rise production.,166134,26525.52,2025-05-03 18:58:13,2025-07-02 18:58:13,PENDIENTE,SOLICITUD_CARGA,,,CG,,,much,,,4,,,34902,,,139608,,,Nor fine imagine.,,,investment,,,,,,FUERA_DE_SERVICIO,,,,,,4,,,,,,6816ad9504ea5839aa7eaa05
6816ad9504ea5839aa7ead26,Center across others environment more stand time.,663970,106012.02,2025-05-03 18:58:13,2025-07-01 18:58:13,PAGADA,SOLICITUD_CARGA,SOLICITUD_DESCARGA,,CN,CN,,ground,room,,9,7,,46180,20334,,415620,142338,,Plant whole project about yet billion should.,Market concern art local visit suggest cup security.,,money,ahead,,,them,,EN_USO,EN_USO,,,EN_USO,,10,9,,,5,,6816ad9504ea5839aa7eaa06
6816ad9504ea5839aa7ead27,Decade do himself choice car.,176037,28106.7,2025-05-03 18:58:13,2025-06-30 18:58:13,CANCELADO,SOLICITUD_CARGA,SOLICITUD_CARGA,,CG,CN,,anything,later,,2,2,,33885,40080,,67770,80160,,Light population itself data wear perform song.,Floor film just current.,,girl,nature,,,,,EN_MANTENIMIENTO,DISPONIBLE,,,,,7,1,,,,,6816ad9504ea5839aa7eaa07
6816ad9504ea5839aa7ead28,Wide seat all whole.,275089,43921.73,2025-05-03 18:58:13,2025-06-21 18:58:13,PENDIENTE,SOLICITUD_CARGA,SOLICITUD_DESCARGA,,RO,GL,,offer,relationship,,1,9,,40367,21200,,40367,190800,,Again traditional per out movement.,Expect plant last.,,necessary,remember,,,,,EN_MANTENIMIENTO,EN_MANTENIMIENTO,,,,,1,1,,,,,6816ad9504ea5839aa7eaa08
6816ad9504ea5839aa7ead29,May star door.,698932,111594.22,2025-05-03 18:58:13,2025-06-16 18:58:13,CANCELADO,SOLICITUD_CARGA,SOLICITUD_CARGA,SOLICITUD_DESCARGA,LQ,GL,LQ,individual,enjoy,offer,5,9,10,13088,22792,31677,65440,205128,316770,Almost view Mr low main.,Bank institution this arm early guess.,Office Democrat whole author reflect college I.,face,hand,,fish,again,everything,EN_MANTENIMIENTO,FUERA_DE_SERVICIO,,DISPONIBLE,EN_USO,EN_USO,6,6,,8,8,7,6816ad9504ea5839aa7eaa09
6816ad9504ea5839aa7ead2a,Born agent base Mrs.,101281,16170.9,2025-05-03 18:58:13,2025-06-07 18:58:13,PAGADA,SOLICITUD_DESCARGA,,,CN,,,traditional,,,6,,,14185,,,85110,,,Sell vote continue article apply paper science.,,,not,,,,,,FUERA_DE_SERVICIO,,,,,,2,,,,,,6816ad9504ea5839aa7eaa0a
6816ad9504ea5839aa7ead2b,Several difficult vote couple behavior fly bring.,210963,33683.2,2025-05-03 18:58:13,2025-06-07 18:58:13,ATRASADO,SOLICITUD_DESCARGA,SOLICITUD_DESCARGA,,GL,CG,,catch,court,,1,4,,14272,40752,,14272,163008,,Also rate only could dog increase artist.,Star capital open trial according realize group.,,serve,little,write,,fund,,EN_MANTENIMIENTO,EN_USO,EN_USO,,EN_MANTENIMIENTO,,9,5,9,,2,,6816ad9504ea5839aa7eaa0b
6816ad9504ea5839aa7ead2c,Large new hand give activity speech source.,212643,33951.48,2025-05-03 18:58:13,2025-06-11 18:58:13,CANCELADO,SOLICITUD_DESCARGA,,,CG,,,chance,,,6,,,29782,,,178692,,,Member I medical coach.,,,yes,,four,,,,EN_USO,,EN_MANTENIMIENTO,,,,6,,3,,,,6816ad9504ea5839aa7eaa0c
6816ad9504ea5839aa7ead2d,Nearly prepare population work so child man.,440288,70298.1,2025-05-03 18:58:13,2025-06-28 18:58:13,PAGADA,SOLICITUD_CARGA,SOLICITUD_DESCARGA,,GL,RO,,very,long,,10,10,,23851,13148,,238510,131480,,Represent my field condition company six five.,Prevent whether field and fast field maybe capital.,,third,same,,,,,FUERA_DE_SERVICIO,DISPONIBLE,,,,,1,4,,,,,6816ad9504ea5839aa7eaa0d
6816ad9504ea5839aa7ead2e,Democratic often value left success source as.,136749,21833.85,2025-05-03 18:58:13,2025-06-25 18:58:13,PENDIENTE,SOLICITUD_DESCARGA,,,GS,,,sometimes,,,5,,,22983,,,114915,,,Rule attention once president hair stock.,,,owner,,alone,,,,DISPONIBLE,,FUERA_DE_SERVICIO,,,,9,,10,,,,6816ad9504ea5839aa7eaa0e
6816ad9504ea5839aa7ead2f,Other create her.,432984,69131.88,2025-05-03 18:58:13,2025-06-28 18:58:13,CANCELADO,SOLICITUD_CARGA,,,GS,,,glass,,,9,,,40428,,,363852,,,Same including large its.,,,worker,,,,,,DISPONIBLE,,,,,,8,,,,,,6816ad9504ea5839aa7eaa0f
6816ad9504ea5839aa7ead30,Whole remember dark.,558530,89177.07,2025-05-03 18:58:13,2025-06-08 18:58:13,CANCELADO,SOLICITUD_CARGA,SOLICITUD_DESCARGA,,GL,LQ,,popular,relate,,9,1,,49820,20973,,448380,20973,,Sign create sing development land again.,Let pick red lawyer manager.,,head,themselves,human,,,,DISPONIBLE,DISPONIBLE,EN_MANTENIMIENTO,,,,1,3,2,,,,6816ad9504ea5839aa7eaa10
6816ad9504ea5839aa7ead31,Window particular movie country design shake teach.,447945,71520.56,2025-05-03 18:58:13,2025-06-18 18:58:13,CANCELADO,SOLICITUD_DESCARGA,,,GS,,,two,,,8,,,47053,,,376424,,,Early yes theory or beat.,,,learn,,there,,,,EN_USO,,EN_USO,,,,7,,8,,,,6816ad9504ea5839aa7eaa11
6816ad9504ea5839aa7ead32,Imagine character bring something both network leg.,587157,93747.71,2025-05-03 18:58:13,2025-06-24 18:58:13,CANCELADO,SOLICITUD_CARGA,SOLICITUD_CARGA,SOLICITUD_CARGA,GL,CG,GS,increase,if,send,3,7,6,21532,32399,33670,64596,226793,202020,Program reflect how story.,News former up key.,Two peace everything set seat make job management.,page,despite,,player,,pull,EN_USO,EN_MANTENIMIENTO,,EN_MANTENIMIENTO,,EN_USO,3,9,,8,,3,6816ad9504ea5839aa7eaa12
6816ad9504ea5839aa7ead33,Mr Mr operation economic available hour.,356986,56997.72,2025-05-03 18:58:13,2025-06-04 18:58:13,ATRASADO,SOLICITUD_CARGA,,,CN,,,answer,,,6,,,49998,,,299988,,,Value guy race ago exist.,,,between,,whom,,,,DISPONIBLE,,EN_USO,,,,8,,10,,,,6816ad9504ea5839aa7eaa13
6816ad9504ea5839aa7ead34,Road factor amount across character collection.,244058,38967.29,2025-05-03 18:58:13,2025-06-30 18:58:13,PENDIENTE,SOLICITUD_DESCARGA,SOLICITUD_CARGA,,CG,GL,,former,risk,,4,1,,47304,15875,,189216,15875,,Fund artist finish story.,Behind center already service.,,apply,bad,member,,,,DISPONIBLE,EN_USO,DISPONIBLE,,,,5,10,7,,,,6816ad9504ea5839aa7eaa14
6816ad9504ea5839aa7ead35,Seven may white create animal base present give.,51970,8297.68,2025-05-03 18:58:13,2025-06-28 18:58:13,PENDIENTE,SOLICITUD_CARGA,,,CN,,,may,,,1,,,43672,,,43672,,,Serious best long decision cost.,,,foot,,,,,,DISPONIBLE,,,,,,7,,,,,,6816ad9504ea5839aa7eaa15
6816ad9504ea5839aa7ead36,Choose church party month wide.,1088737,173831.95,2025-05-03 18:58:13,2025-06-11 18:58:13,CANCELADO,SOLICITUD_DESCARGA,SOLICITUD_DESCARGA,SOLICITUD_CARGA,GL,GS,RO,understand,charge,kid,2,10,9,19346,45657,46627,38692,456570,419643,Radio cup explain case available event.,Involve measure top age pull blood.,Base question never add of each.,full,not,throughout,red,study,inside,EN_USO,DISPONIBLE,EN_MANTENIMIENTO,EN_MANTENIMIENTO,EN_MANTENIMIENTO,EN_USO,5,2,7,2,1,4,6816ad9504ea5839aa7eaa16
