6816ad9504ea5839aa7eae46,Dream billion first little grow.,131309,20965.36,2025-05-03 18:58:13,2025-06-23 18:58:13,CANCELADO,SOLICITUD_CARGA,,,CG,,,after,,,8,,,13793,,,110344,,,Group room stop degree.,,,me,,,,,,EN_USO,,,,,,3,,,,,,6816ad9504ea5839aa7eab26
6816ad9504ea5839aa7eae47,Child different century upon respond character factor.,498383,79573.71,2025-05-03 18:58:13,2025-06-06 18:58:13,PENDIENTE,SOLICITUD_DESCARGA,SOLICITUD_CARGA,SOLICITUD_CARGA,LQ,RO,GL,bill,hold,economy,1,1,8,35604,38997,43026,35604,38997,344208,Law population yourself perform police program.,Coach check wind enjoy.,Such medical hope admit feeling.,point,choice,role,political,word,,EN_USO,FUERA_DE_SERVICIO,EN_USO,DISPONIBLE,FUERA_DE_SERVICIO,,5,8,3,9,8,,6816ad9504ea5839aa7eab27
6816ad9504ea5839aa7eae48,Increase service maintain suggest in I.,275806,44036.3,2025-05-03 18:58:13,2025-06-17 18:58:13,CANCELADO,SOLICITUD_CARGA,,,GS,,,soon,,,5,,,46354,,,231770,,,Story son teacher recognize.,,,model,,benefit,,,,EN_MANTENIMIENTO,,EN_USO,,,,7,,2,,,,6816ad9504ea5839aa7eab28
6816ad9504ea5839aa7eae49,Ok very win accept account we.,257690,41143.74,2025-05-03 18:58:13,2025-06-07 18:58:13,PAGADA,SOLICITUD_DESCARGA,SOLICITUD_DESCARGA,,RO,RO,,guy,box,,1,9,,40974,19508,,40974,175572,,Evening out fight age analysis.,Beat respond reveal war.,,charge,serious,,,late,,FUERA_DE_SERVICIO,EN_MANTENIMIENTO,,,EN_USO,,8,5,,,2,,6816ad9504ea5839aa7eab29
6816ad9504ea5839aa7eae4a,Cover scene work PM goal Congress rise.,174341,27835.95,2025-05-03 18:58:13,2025-06-25 18:58:13,CANCELADO,SOLICITUD_CARGA,SOLICITUD_DESCARGA,,CN,GL,,local,use,,1,7,,19595,18130,,19595,126910,,Else we group whom spend down news.,Become per great knowledge.,,near,yard,base,,,,FUERA_DE_SERVICIO,DISPONIBLE,FUERA_DE_SERVICIO,,,,2,3,1,,,,6816ad9504ea5839aa7eab2a
6816ad9504ea5839aa7eae4b,Without parent player key land.,286460,45737.37,2025-05-03 18:58:13,2025-06-09 18:58:13,PENDIENTE,SOLICITUD_CARGA,SOLICITUD_DESCARGA,,LQ,CG,,forget,major,,5,2,,35713,31079,,178565,62158,,Impact itself situation nice interest third.,Act stay six son military month believe claim.,,paper,tonight,,,,,EN_USO,DISPONIBLE,,,,,4,1,,,,,6816ad9504ea5839aa7eab2b
6816ad9504ea5839aa7eae4c,Affect during particularly former mother type mouth science.,734494,117272.18,2025-05-03 18:58:13,2025-06-14 18:58:13,PENDIENTE,SOLICITUD_CARGA,SOLICITUD_DESCARGA,SOLICITUD_DESCARGA,CG,GL,GS,top,night,everyone,2,8,8,42243,27310,39282,84486,218480,314256,Less nor answer federal throughout present east somebody.,Magazine yard short camera.,Thank her significant girl itself series especially.,agreement,theory,,bag,,,FUERA_DE_SERVICIO,EN_MANTENIMIENTO,,DISPONIBLE,,,1,10,,6,,,6816ad9504ea5839aa7eab2c
6816ad9504ea5839aa7eae4d,Employee it board short thus many notice.,753702,120338.97,2025-05-03 18:58:13,2025-06-28 18:58:13,PENDIENTE,SOLICITUD_DESCARGA,SOLICITUD_DESCARGA,,GL,CN,,discover,western,,9,6,,43757,39925,,393813,239550,,Together art may standard case.,Sort or her finish represent medical early.,,lawyer,her,push,,fight,,EN_USO,EN_MANTENIMIENTO,EN_MANTENIMIENTO,,FUERA_DE_SERVICIO,,5,9,2,,7,,6816ad9504ea5839aa7eab2d
6816ad9504ea5839aa7eae4e,Clearly record of grow own.,303736,48495.6,2025-05-03 18:58:13,2025-07-01 18:58:13,PENDIENTE,SOLICITUD_CARGA,,,CG,,,near,,,9,,,28360,,,255240,,,Nearly effect middle they represent start.,,,general,,most,,,,DISPONIBLE,,DISPONIBLE,,,,8,,9,,,,6816ad9504ea5839aa7eab2e
6816ad9504ea5839aa7eae4f,Consider bring according sure early.,439753,70212.6,2025-05-03 18:58:13,2025-06-23 18:58:13,PENDIENTE,SOLICITUD_DESCARGA,SOLICITUD_DESCARGA,SOLICITUD_CARGA,CG,GL,GL,each,break,newspaper,8,2,3,26910,46251,20586,215280,92502,61758,Anyone camera down happy.,Time assume inside reach talk take.,Analysis three culture his medical music.,assume,actually,,use,race,drop,EN_MANTENIMIENTO,EN_USO,,EN_MANTENIMIENTO,EN_MANTENIMIENTO,FUERA_DE_SERVICIO,5,6,,8,8,5,6816ad9504ea5839aa7eab2f
6816ad9504ea5839aa7eae50,Together fine fact light.,182722,29174.12,2025-05-03 18:58:13,2025-06-08 18:58:13,ATRASADO,SOLICITUD_DESCARGA,,,RO,,,friend,,,4,,,38387,,,153548,,,Spend activity author force you democratic.,,,evidence,,,,,,EN_USO,,,,,,5,,,,,,6816ad9504ea5839aa7eab30
6816ad9504ea5839aa7eae51,Nation environmental smile.,120438,19229.52,2025-05-03 18:58:13,2025-06-04 18:58:13,PAGADA,SOLICITUD_CARGA,SOLICITUD_CARGA,,GL,CN,,lead,night,,5,1,,18024,11088,,90120,11088,,Issue around large cut sense pick action amount.,Stuff positive word.,,exactly,newspaper,,,,,EN_USO,DISPONIBLE,,,,,1,1,,,,,6816ad9504ea5839aa7eab31
6816ad9504ea5839aa7eae52,Able new quality water personal early.,265826,42442.77,2025-05-03 18:58:13,2025-06-05 18:58:13,PENDIENTE,SOLICITUD_CARGA,SOLICITUD_DESCARGA,,LQ,RO,,ask,type,,7,1,,30273,11472,,211911,11472,,Everything hundred coach term remain model figure popular.,Current positive sign glass population.,,hold,list,wind,,into,,EN_USO,DISPONIBLE,DISPONIBLE,,DISPONIBLE,,8,1,4,,1,,6816ad9504ea5839aa7eab32
6816ad9504ea5839aa7eae53,Political tax until field seat science data far.,714114,114018.24,2025-05-03 18:58:13,2025-06-29 18:58:13,PENDIENTE,SOLICITUD_DESCARGA,SOLICITUD_DESCARGA,SOLICITUD_CARGA,CN,GL,CG,pressure,voice,company,8,9,6,47985,12708,16974,383880,114372,101844,Many truth recent six human what.,Weight both personal cost staff discuss.,Star near maybe hospital.,produce,onto,,entire,,,EN_USO,DISPONIBLE,,DISPONIBLE,,,4,3,,1,,,6816ad9504ea5839aa7eab33
6816ad9504ea5839aa7eae54,Song near behavior.,434671,69401.3,2025-05-03 18:58:13,2025-06-04 18:58:13,CANCELADO,SOLICITUD_DESCARGA,SOLICITUD_DESCARGA,,GL,CG,,head,fly,,5,7,,25727,33805,,128635,236635,,Value difference live.,Series woman doctor student.,,international,several,,,,,EN_MANTENIMIENTO,EN_USO,,,,,5,9,,,,,6816ad9504ea5839aa7eab34
6816ad9504ea5839aa7eae55,Want effect power window military.,599943,95789.26,2025-05-03 18:58:13,2025-06-06 18:58:13,PENDIENTE,SOLICITUD_CARGA,SOLICITUD_DESCARGA,,GL,GS,,area,computer,,3,10,,49348,35611,,148044,356110,,Never interview despite top firm car cell.,Player finish project him three government.,,such,sure,,,,,DISPONIBLE,FUERA_DE_SERVICIO,,,,,2,2,,,,,6816ad9504ea5839aa7eab35
6816ad9504ea5839aa7eae56,Society together especially machine per enjoy land.,457825,73098.13,2025-05-03 18:58:13,2025-06-08 18:58:13,CANCELADO,SOLICITUD_CARGA,SOLICITUD_DESCARGA,SOLICITUD_DESCARGA,RO,GL,CG,theory,the,wish,9,2,10,24363,22205,12105,219267,44410,121050,Mrs never party could in sea region movement.,Return buy morning until our.,Finish only minute.,first,consumer,,since,,among,EN_MANTENIMIENTO,EN_USO,,DISPONIBLE,,FUERA_DE_SERVICIO,5,7,,10,,3,6816ad9504ea5839aa7eab36
6816ad9504ea5839aa7eae57,Unit first deal director approach game tax.,649115,103640.25,2025-05-03 18:58:13,2025-06-16 18:58:13,PAGADA,SOLICITUD_DESCARGA,SOLICITUD_CARGA,SOLICITUD_CARGA,CG,LQ,GL,official,minute,economy,2,10,5,32360,34654,26843,64720,346540,134215,Though remember man teach career employee simply modern.,Type everything manager pick best business painting.,Memory imagine certainly might participant many fire.,walk,visit,image,value,,evidence,FUERA_DE_SERVICIO,DISPONIBLE,DISPONIBLE,EN_MANTENIMIENTO,,EN_MANTENIMIENTO,3,4,9,9,,4,6816ad9504ea5839aa7eab37
6816ad9504ea5839aa7eae58,Green stage help civil heart who their.,450872,71987.96,2025-05-03 18:58:13,2025-06-03 18:58:13,CANCELADO,SOLICITUD_CARGA,SOLICITUD_DESCARGA,SOLICITUD_CARGA,GL,GS,CN,sign,agency,wait,7,7,2,19888,20366,48553,139216,142562,97106,Election impact camera dark store.,Truth save enjoy personal bill situation month.,Charge feeling institution ahead friend teach science floor.,international,reality,name,laugh,,,FUERA_DE_SERVICIO,EN_MANTENIMIENTO,EN_USO,FUERA_DE_SERVICIO,,,10,3,9,8,,,6816ad9504ea5839aa7eab38
6816ad9504ea5839aa7eae59,Whom population thousand individual animal.,591178,94389.72,2025-05-03 18:58:13,2025-06-04 18:58:13,ATRASADO,SOLICITUD_CARGA,SOLICITUD_CARGA,,GS,GS,,nothing,focus,,9,3,,43235,35891,,389115,107673,,My series weight care development.,Box close Mrs become pass represent after science.,,ready,usually,fly,,,,EN_MANTENIMIENTO,FUERA_DE_SERVICIO,EN_MANTENIMIENTO,,,,5,2,1,,,,6816ad9504ea5839aa7eab39
6816ad9504ea5839aa7eae5a,Right stay several.,408972,65298.06,2025-05-03 18:58:13,2025-06-27 18:58:13,CANCELADO,SOLICITUD_CARGA,SOLICITUD_DESCARGA,,GL,RO,,those,through,,10,6,,13917,34084,,139170,204504,,Plan claim effort door when.,Bank save ahead from still college.,,difficult,dark,property,,exactly,,DISPONIBLE,EN_USO,EN_USO,,FUERA_DE_SERVICIO,,10,2,1,,5,,6816ad9504ea5839aa7eab3a
6816ad9504ea5839aa7eae5b,Nature over tell explain there teacher.,129148,20620.32,2025-05-03 18:58:13,2025-06-22 18:58:13,PAGADA,SOLICITUD_DESCARGA,,,CG,,,myself,,,3,,,36176,,,108528,,,Water assume work still green see.,,,company,,,,,,DISPONIBLE,,,,,,9,,,,,,6816ad9504ea5839aa7eab3b
6816ad9504ea5839aa7eae5c,Reality understand charge state.,425648,67960.53,2025-05-03 18:58:13,2025-06-03 18:58:13,ATRASADO,SOLICITUD_DESCARGA,SOLICITUD_CARGA,,RO,CG,,appear,product,,3,7,,10848,46449,,32544,325143,,Camera our mother wrong plan point.,Yourself wish rule social forget style national more.,,remember,show,pull,,group,,FUERA_DE_SERVICIO,FUERA_DE_SERVICIO,EN_MANTENIMIENTO,,EN_MANTENIMIENTO,,1,2,7,,8,,6816ad9504ea5839aa7eab3c
6816ad9504ea5839aa7eae5d,Talk next Republican space might since.,280527,44790.03,2025-05-03 18:58:13,2025-07-01 18:58:13,CANCELADO,SOLICITUD_DESCARGA,SOLICITUD_DESCARGA,SOLICITUD_CARGA,CG,CG,CG,toward,claim,sister,2,7,1,21999,24496,20267,43998,171472,20267,Much Democrat base movement machine maintain now.,Along play attack leader.,Mouth available through prove unit with.,lead,true,inside,total,,,EN_USO,FUERA_DE_SERVICIO,EN_USO,FUERA_DE_SERVICIO,,,6,9,6,1,,,6816ad9504ea5839aa7eab3d
6816ad9504ea5839aa7eae5e,Star fall grow growth.,420379,67119.4,2025-05-03 18:58:13,2025-06-11 18:58:13,CANCELADO,SOLICITUD_CARGA,SOLICITUD_CARGA,SOLICITUD_CARGA,RO,GS,LQ,believe,right,by,3,7,5,29969,11519,36544,89907,80633,182720,Position sometimes computer over experience ask area end.,Right one process tonight forget game.,Item pressure system turn different entire.,visit,check,tend,production,deal,point,EN_MANTENIMIENTO,EN_MANTENIMIENTO,EN_MANTENIMIENTO,DISPONIBLE,EN_USO,EN_USO,2,3,1,5,4,6,6816ad9504ea5839aa7eab3e
6816ad9504ea5839aa7eae5f,Hear successful seek factor structure.,838707,133911.24,2025-05-03 18:58:13,2025-06-23 18:58:13,PENDIENTE,SOLICITUD_CARGA,SOLICITUD_CARGA,SOLICITUD_CARGA,RO,CG,GS,sea,glass,fight,7,10,5,25573,42625,19907,179011,426250,99535,Nor talk social suddenly.,Case worker put word.,Himself issue bring other population off.,read,provide,time,customer,,,EN_USO,DISPONIBLE,FUERA_DE_SERVICIO,EN_USO,,,8,2,1,3,,,6816ad9504ea5839aa7eab3f
6816ad9504ea5839aa7eae60,Rate call another budget huge.,72616,11594.18,2025-05-03 18:58:13,2025-06-10 18:58:13,PENDIENTE,SOLICITUD_DESCARGA,SOLICITUD_CARGA,,LQ,RO,,discussion,first,,2,1,,10744,39534,,21488,39534,,Much analysis hour big around arrive.,Bill join score activity home occur.,,support,until,,,,,EN_MANTENIMIENTO,EN_MANTENIMIENTO,,,,,10,8,,,,,6816ad9504ea5839aa7eab40
6816ad9504ea5839aa7eae61,Line about number support our marriage it.,527282,84187.86,2025-05-03 18:58:13,2025-06-03 18:58:13,PAGADA,SOLICITUD_DESCARGA,SOLICITUD_DESCARGA,,GS,CN,,add,now,,6,6,,44914,28935,,269484,173610,,Quite sport staff truth like present reveal.,Rather light add somebody long.,,even,dog,left,,,,EN_USO,FUERA_DE_SERVICIO,EN_MANTENIMIENTO,,,,10,4,1,,,,6816ad9504ea5839aa7eab41
6816ad9504ea5839aa7eae62,Toward pull appear how heavy heart pull.,573850,91623.13,2025-05-03 18:58:13,2025-06-12 18:58:13,PENDIENTE,SOLICITUD_DESCARGA,SOLICITUD_CARGA,SOLICITUD_CARGA,CG,GL,GS,represent,citizen,able,9,9,4,19568,29407,10363,176112,264663,41452,Claim American bill just institution research total.,Protect different blue manage nearly but American face.,Clearly traditional cup else past situation food.,watch,later,,article,decade,per,FUERA_DE_SERVICIO,DISPONIBLE,,DISPONIBLE,EN_USO,EN_MANTENIMIENTO,8,3,,6,2,3,6816ad9504ea5839aa7eab42
6816ad9504ea5839aa7eae63,How claim available tree financial.,663575,105948.94,2025-05-03 18:58:13,2025-06-25 18:58:13,PAGADA,SOLICITUD_CARGA,SOLICITUD_CARGA,SOLICITUD_DESCARGA,CG,GS,CG,itself,almost,bag,3,8,6,39132,37889,22853,117396,303112,137118,Head reveal building decision behavior.,Call significant worry might.,Our building tell organization.,policy,office,get,bank,approach,claim,EN_MANTENIMIENTO,EN_MANTENIMIENTO,FUERA_DE_SERVICIO,DISPONIBLE,FUERA_DE_SERVICIO,EN_USO,6,5,5,2,5,9,6816ad9504ea5839aa7eab43
6816ad9504ea5839aa7eae64,Single form plant.,655999,104739.4,2025-05-03 18:58:13,2025-06-04 18:58:13,CANCELADO,SOLICITUD_DESCARGA,SOLICITUD_CARGA,,GS,GS,,table,purpose,,10,5,,33162,43928,,331620,219640,,Drop college right exist energy you.,Something happy reveal charge teach huge certainly.,,effect,over,,,education,,EN_USO,EN_MANTENIMIENTO,,,FUERA_DE_SERVICIO,,9,8,,,1,,6816ad9504ea5839aa7eab44
6816ad9504ea5839aa7eae65,Though fast wall have across.,145206,23184.18,2025-05-03 18:58:13,2025-06-05 18:58:13,PENDIENTE,SOLICITUD_DESCARGA,,,RO,,,sister,,,3,,,40674,,,122022,,,Maintain involve physical surface sometimes mouth both.,,,defense,,others,,,,DISPONIBLE,,EN_USO,,,,2,,4,,,,6816ad9504ea5839aa7eab45
6816ad9504ea5839aa7eae66,Foreign put among side.,334806,53456.5,2025-05-03 18:58:13,2025-06-08 18:58:13,PENDIENTE,SOLICITUD_DESCARGA,SOLICITUD_DESCARGA,,CN,LQ,,dog,have,,4,6,,28063,28183,,112252,169098,,Yard letter push.,Together place despite career nice citizen.,,together,audience,,,eye,,FUERA_DE_SERVICIO,FUERA_DE_SERVICIO,,,EN_MANTENIMIENTO,,8,10,,,9,,6816ad9504ea5839aa7eab46
6816ad9504ea5839aa7eae67,Here serve in lead middle appear quality ready.,408020,65146.06,2025-05-03 18:58:13,2025-06-07 18:58:13,PENDIENTE,SOLICITUD_CARGA,SOLICITUD_CARGA,SOLICITUD_CARGA,CG,RO,LQ,work,foot,say,5,6,1,31579,25374,32735,157895,152244,32735,Painting practice memory let member.,Price anything each amount.,Thing cup summer believe present prepare.,brother,total,charge,dark,check,,EN_MANTENIMIENTO,FUERA_DE_SERVICIO,FUERA_DE_SERVICIO,EN_USO,EN_USO,,8,5,6,1,3,,6816ad9504ea5839aa7eab47
6816ad9504ea5839aa7eae68,Gun around eight no prevent believe say politics.,271330,43321.52,2025-05-03 18:58:13,2025-06-02 18:58:13,PAGADA,SOLICITUD_CARGA,SOLICITUD_DESCARGA,,LQ,CG,,another,of,,4,5,,14902,33680,,59608,168400,,Subject off man one.,Decision effort list theory fire game.,,live,about,,,condition,,EN_MANTENIMIENTO,EN_MANTENIMIENTO,,,FUERA_DE_SERVICIO,,10,1,,,8,,6816ad9504ea5839aa7eab48
6816ad9504ea5839aa7eae69,Scene others possible article trial.,892357,142477.2,2025-05-03 18:58:13,2025-06-14 18:58:13,PAGADA,SOLICITUD_CARGA,SOLICITUD_CARGA,,CG,CG,,store,his,,10,10,,39957,35031,,399570,350310,,Force writer nice hand.,Police allow traditional hotel.,,yeah,bad,,,,,EN_USO,EN_MANTENIMIENTO,,,,,7,5,,,,,6816ad9504ea5839aa7eab49
6816ad9504ea5839aa7eae6a,Mention doctor minute yes soldier.,239411,38225.34,2025-05-03 18:58:13,2025-06-20 18:58:13,ATRASADO,SOLICITUD_CARGA,,,LQ,,,interesting,,,6,,,33531,,,201186,,,Long my media surface.,,,consumer,,,,,,EN_USO,,,,,,3,,,,,,6816ad9504ea5839aa7eab4a
6816ad9504ea5839aa7eae6b,Poor future bag treatment difference wind article.,788142,125837.76,2025-05-03 18:58:13,2025-06-27 18:58:13,CANCELADO,SOLICITUD_DESCARGA,SOLICITUD_CARGA,SOLICITUD_CARGA,CN,CG,GS,try,student,someone,8,8,8,20334,28507,33947,162672,228056,271576,Play beautiful drop true rule sound thus.,He floor pattern low draw reflect way question.,Us more color color.,Republican,able,,executive,,,DISPONIBLE,DISPONIBLE,,EN_MANTENIMIENTO,,,3,9,,5,,,6816ad9504ea5839aa7eab4b
6816ad9504ea5839aa7eae6c,Almost institution seem senior game term positive.,512520,81830.91,2025-05-03 18:58:13,2025-06-03 18:58:13,PENDIENTE,SOLICITUD_CARGA,SOLICITUD_DESCARGA,SOLICITUD_DESCARGA,CN,CN,CN,hour,far,majority,5,10,2,21005,26797,28847,105025,267970,57694,Huge need someone arrive inside piece agency be.,Network nation practice course change now.,Story hundred family stand able turn adult.,mission,worry,soon,reach,,,FUERA_DE_SERVICIO,DISPONIBLE,EN_USO,DISPONIBLE,,,10,2,8,4,,,6816ad9504ea5839aa7eab4c
6816ad9504ea5839aa7eae6d,Majority western adult history break.,738757,117952.76,2025-05-03 18:58:13,2025-06-23 18:58:13,PAGADA,SOLICITUD_DESCARGA,SOLICITUD_DESCARGA,SOLICITUD_CARGA,CN,RO,GL,hear,capital,author,9,7,5,39290,18532,27494,353610,129724,137470,Radio prepare mention real including glass.,Them speech professor much green citizen all least.,Respond fact picture something same clear.,standard,dark,,learn,who,nation,EN_MANTENIMIENTO,FUERA_DE_SERVICIO,,EN_MANTENIMIENTO,FUERA_DE_SERVICIO,DISPONIBLE,6,3,,5,6,1,6816ad9504ea5839aa7eab4d
6816ad9504ea5839aa7eae6e,Away develop environmental receive kind tree condition.,207238,33088.5,2025-05-03 18:58:13,2025-06-18 18:58:13,PAGADA,SOLICITUD_DESCARGA,,,GS,,,federal,,,10,,,17415,,,174150,,,Most country customer pattern.,,,as,,,,,,EN_MANTENIMIENTO,,,,,,10,,,,,,6816ad9504ea5839aa7eab4e
6816ad9504ea5839aa7eae6f,Return enough end from.,381745,60950.86,2025-05-03 18:58:13,2025-06-11 18:58:13,ATRASADO,SOLICITUD_DESCARGA,SOLICITUD_DESCARGA,,GL,CN,,above,throughout,,1,10,,23904,29689,,23904,296890,,Can exactly clearly local walk must.,Of want receive ever fill enough traditional.,,common,yet,prepare,,amount,,DISPONIBLE,EN_USO,EN_USO,,EN_MANTENIMIENTO,,6,5,10,,9,,6816ad9504ea5839aa7eab4f
6816ad9504ea5839aa7eae70,Perhaps stop officer never move.,108848,17379.11,2025-05-03 18:58:13,2025-06-17 18:58:13,PENDIENTE,SOLICITUD_DESCARGA,SOLICITUD_DESCARGA,,GS,GS,,operation,American,,5,1,,13326,24839,,66630,24839,,However win week write else trial reality plan.,Bar American style answer stock tree.,,will,weight,,,,,EN_USO,FUERA_DE_SERVICIO,,,,,4,5,,,,,6816ad9504ea5839aa7eab50
6816ad9504ea5839aa7eae71,Here none treatment month difference remember.,373227,59590.84,2025-05-03 18:58:13,2025-06-30 18:58:13,PAGADA,SOLICITUD_CARGA,SOLICITUD_DESCARGA,SOLICITUD_DESCARGA,GL,LQ,CG,find,poor,cell,4,8,4,20678,12812,32107,82712,102496,128428,Wife produce indeed.,Tonight gas industry step reveal trial.,Job story work design information produce billion.,wind,never,,as,know,,EN_USO,FUERA_DE_SERVICIO,,EN_USO,FUERA_DE_SERVICIO,,2,4,,6,5,,6816ad9504ea5839aa7eab51
6816ad9504ea5839aa7eae72,Behavior knowledge strategy past pass health.,225988,36082.14,2025-05-03 18:58:13,2025-06-11 18:58:13,CANCELADO,SOLICITUD_DESCARGA,SOLICITUD_CARGA,SOLICITUD_CARGA,GL,RO,LQ,democratic,seat,firm,2,4,2,16203,18914,40922,32406,75656,81844,Worker describe future speak too.,Fight indicate area.,Born including statement amount hard sort southern.,center,smile,,management,,,FUERA_DE_SERVICIO,EN_MANTENIMIENTO,,EN_MANTENIMIENTO,,,3,3,,10,,,6816ad9504ea5839aa7eab52
6816ad9504ea5839aa7eae73,Over indicate imagine which that space.,804233,128406.94,2025-05-03 18:58:13,2025-06-08 18:58:13,ATRASADO,SOLICITUD_CARGA,SOLICITUD_DESCARGA,SOLICITUD_DESCARGA,GS,LQ,CG,success,clearly,woman,5,9,6,40106,43060,14626,200530,387540,87756,During stock bar outside.,Type trouble over Congress member hold forward like.,Among them politics tree experience.,quite,include,only,listen,,,FUERA_DE_SERVICIO,EN_USO,EN_USO,EN_MANTENIMIENTO,,,4,6,3,1,,,6816ad9504ea5839aa7eab53
6816ad9504ea5839aa7eae74,Sign success organization professional defense.,380206,60705.19,2025-05-03 18:58:13,2025-06-27 18:58:13,CANCELADO,SOLICITUD_CARGA,,,GS,,,pull,,,7,,,45643,,,319501,,,Practice purpose only.,,,visit,,,,,,EN_MANTENIMIENTO,,,,,,1,,,,,,6816ad9504ea5839aa7eab54
6816ad9504ea5839aa7eae75,Toward body bring sister rise serious.,267560,42719.6,2025-05-03 18:58:13,2025-06-22 18:58:13,ATRASADO,SOLICITUD_DESCARGA,SOLICITUD_CARGA,SOLICITUD_CARGA,CN,LQ,CG,one,total,wind,5,2,7,11562,14509,19716,57810,29018,138012,Area successful two open list term describe.,Send choose political manager.,National agreement how have to increase.,ten,stop,,moment,,,EN_MANTENIMIENTO,DISPONIBLE,,DISPONIBLE,,,10,7,,7,,,6816ad9504ea5839aa7eab55
6816ad9504ea5839aa7eae76,Foot heart fly.,720691,115068.37,2025-05-03 18:58:13,2025-06-05 18:58:13,PENDIENTE,SOLICITUD_CARGA,SOLICITUD_CARGA,SOLICITUD_DESCARGA,GL,GS,CN,start,event,around,9,2,5,37170,27554,43197,334530,55108,215985,Share a behind action space artist.,Wall among bit again avoid whatever.,Father public eye name.,they,large,,stand,song,claim,EN_MANTENIMIENTO,EN_MANTENIMIENTO,,DISPONIBLE,FUERA_DE_SERVICIO,EN_MANTENIMIENTO,5,9,,5,10,10,6816ad9504ea5839aa7eab56
6816ad9504ea5839aa7eae77,Instead project left consumer indicate picture brother.,478416,76385.7,2025-05-03 18:58:13,2025-06-19 18:58:13,CANCELADO,SOLICITUD_DESCARGA,,,CG,,,month,,,9,,,44670,,,402030,,,Military dark someone rest.,,,small,,never,,,,FUERA_DE_SERVICIO,,EN_MANTENIMIENTO,,,,3,,7,,,,6816ad9504ea5839aa7eab57
6816ad9504ea5839aa7eae78,Production half seat several often exactly art.,146697,23422.25,2025-05-03 18:58:13,2025-06-13 18:58:13,CANCELADO,SOLICITUD_CARGA,,,RO,,,particularly,,,5,,,24655,,,123275,,,Pattern force interesting important nation laugh read.,,,attorney,,other,,,,EN_MANTENIMIENTO,,EN_MANTENIMIENTO,,,,5,,5,,,,6816ad9504ea5839aa7eab58
6816ad9504ea5839aa7eae79,Late out particularly little growth.,637046,101713.27,2025-05-03 18:58:13,2025-06-07 18:58:13,PAGADA,SOLICITUD_DESCARGA,SOLICITUD_DESCARGA,,CG,RO,,listen,industry,,9,10,,21057,34582,,189513,345820,,Contain board loss number down.,Page since enter program range.,,different,between,,,chair,,DISPONIBLE,FUERA_DE_SERVICIO,,,EN_MANTENIMIENTO,,7,8,,,1,,6816ad9504ea5839aa7eab59
6816ad9504ea5839aa7eae7a,Information upon brother campaign.,572459,91401.02,2025-05-03 18:58:13,2025-06-27 18:58:13,PAGADA,SOLICITUD_DESCARGA,SOLICITUD_DESCARGA,,LQ,LQ,,until,large,,10,3,,39968,27126,,399680,81378,,Against blue best say.,For study practice difference office no finally.,,number,analysis,whose,,speak,,EN_USO,FUERA_DE_SERVICIO,EN_USO,,EN_USO,,4,7,3,,4,,6816ad9504ea5839aa7eab5a
6816ad9504ea5839aa7eae7b,Bed side however past create nothing.,570935,91157.63,2025-05-03 18:58:13,2025-06-18 18:58:13,PENDIENTE,SOLICITUD_CARGA,SOLICITUD_DESCARGA,SOLICITUD_CARGA,RO,CG,GS,movement,language,seem,6,5,4,37825,36927,17048,226950,184635,68192,Large summer central animal beyond.,They certainly different claim piece.,West sort like religious meeting cost.,increase,environmental,,blue,,,FUERA_DE_SERVICIO,EN_USO,,DISPONIBLE,,,1,5,,3,,,6816ad9504ea5839aa7eab5b
6816ad9504ea5839aa7eae7c,Bring nice have.,129056,20605.5,2025-05-03 18:58:13,2025-06-27 18:58:13,PENDIENTE,SOLICITUD_CARGA,,,CG,,,easy,,,10,,,10845,,,108450,,,Window ground knowledge responsibility service source agreement down.,,,cultural,,bring,,,,EN_MANTENIMIENTO,,DISPONIBLE,,,,2,,2,,,,6816ad9504ea5839aa7eab5c
6816ad9504ea5839aa7eae7d,Movement skin pattern dark.,73321,11706.66,2025-05-03 18:58:13,2025-06-20 18:58:13,PENDIENTE,SOLICITUD_DESCARGA,,,CN,,,then,,,6,,,10269,,,61614,,,Six realize him social three tonight.,,,star,,,,,,EN_USO,,,,,,7,,,,,,6816ad9504ea5839aa7eab5d
6816ad9504ea5839aa7eae7e,State allow quality million PM stock field.,329154,52554,2025-05-03 18:58:13,2025-06-24 18:58:13,PENDIENTE,SOLICITUD_CARGA,,,CG,,,change,,,6,,,46100,,,276600,,,Force energy only side worker affect call always.,,,big,,,,,,EN_MANTENIMIENTO,,,,,,10,,,,,,6816ad9504ea5839aa7eab5e
6816ad9504ea5839aa7eae7f,Office president daughter within sport next pretty.,79761,12734.94,2025-05-03 18:58:13,2025-06-30 18:58:13,PAGADA,SOLICITUD_CARGA,,,CG,,,clearly,,,6,,,11171,,,67026,,,Mr get at bill a security short.,,,into,,,,,,FUERA_DE_SERVICIO,,,,,,8,,,,,,6816ad9504ea5839aa7eab5f
6816ad9504ea5839aa7eae80,Remain increase Democrat data cultural but make now.,14406,2300.14,2025-05-03 18:58:13,2025-06-28 18:58:13,PAGADA,SOLICITUD_CARGA,,,CG,,,year,,,1,,,12106,,,12106,,,Enter business list sort during group.,,,reflect,,actually,,,,EN_USO,,EN_USO,,,,2,,5,,,,6816ad9504ea5839aa7eab60
6816ad9504ea5839aa7eae81,Game theory imagine list although nearly.,231099,36898.19,2025-05-03 18:58:13,2025-06-17 18:58:13,PAGADA,SOLICITUD_DESCARGA,,,GL,,,spring,,,7,,,27743,,,194201,,,Even western happy close Democrat opportunity night.,,,worker,,training,,,,DISPONIBLE,,DISPONIBLE,,,,10,,7,,,,6816ad9504ea5839aa7eab61
6816ad9504ea5839aa7eae82,Single art window describe along one.,218544,34893.5,2025-05-03 18:58:13,2025-06-03 18:58:13,PAGADA,SOLICITUD_CARGA,,,LQ,,,go,,,5,,,36730,,,183650,,,Year everyone class employee choose act mother.,,,paper,,rate,,,,DISPONIBLE,,EN_MANTENIMIENTO,,,,4,,9,,,,6816ad9504ea5839aa7eab62
6816ad9504ea5839aa7eae83,Personal need result Mrs nature other ago.,444810,71020.1,2025-05-03 18:58:13,2025-06-29 18:58:13,ATRASADO,SOLICITUD_DESCARGA,SOLICITUD_DESCARGA,SOLICITUD_DESCARGA,CG,CG,GL,American,follow,marriage,5,2,4,48978,40716,11867,244890,81432,47468,Contain mouth or happen generation as quickly.,Friend smile leader be high break.,Clear clearly show plan beyond.,indicate,significant,,painting,tell,,FUERA_DE_SERVICIO,DISPONIBLE,,FUERA_DE_SERVICIO,FUERA_DE_SERVICIO,,3,7,,2,9,,6816ad9504ea5839aa7eab63
6816ad9504ea5839aa7eae84,Spring result young seem hospital remember miss.,955011,152480.7,2025-05-03 18:58:13,2025-06-17 18:58:13,ATRASADO,SOLICITUD_CARGA,SOLICITUD_DESCARGA,SOLICITUD_DESCARGA,GS,GL,RO,analysis,bag,realize,10,8,10,45185,21540,17836,451850,172320,178360,Administration beautiful west.,Today away fly turn nice particularly TV travel.,Window away production month I wait.,face,front,,various,before,environmental,EN_MANTENIMIENTO,DISPONIBLE,,EN_USO,EN_MANTENIMIENTO,DISPONIBLE,4,1,,3,8,9,6816ad9504ea5839aa7eab64
6816ad9504ea5839aa7eae85,Attack perform eye box goal country.,150473,24025.12,2025-05-03 18:58:13,2025-06-23 18:58:13,PENDIENTE,SOLICITUD_DESCARGA,SOLICITUD_CARGA,,CN,GL,,short,evidence,,2,3,,37544,17120,,75088,51360,,Job state wind Mrs.,Music program Congress compare family by choose.,,agree,citizen,,,,,EN_MANTENIMIENTO,DISPONIBLE,,,,,3,8,,,,,6816ad9504ea5839aa7eab65
