6816ad9504ea5839aa7eadc0,Dinner measure car nearly book figure instead.,104958,16758,2025-05-03 18:58:13,2025-07-01 18:58:13,PAGADA,SOLICITUD_DESCARGA,,,CG,,,movie,,,2,,,44100,,,88200,,,Agree answer election country.,,,before,,,,,,DISPONIBLE,,,,,,10,,,,,,6816ad9504ea5839aa7eaaa0
6816ad9504ea5839aa7eadc1,Man from never share style artist work.,303355,48434.8,2025-05-03 18:58:13,2025-06-22 18:58:13,PAGADA,SOLICITUD_CARGA,,,CG,,,audience,,,10,,,25492,,,254920,,,While cover fast voice name social cover.,,,increase,,,,,,EN_USO,,,,,,5,,,,,,6816ad9504ea5839aa7eaaa1
6816ad9504ea5839aa7eadc2,Pretty easy fear improve drop tree.,384513,61392.8,2025-05-03 18:58:13,2025-06-09 18:58:13,ATRASADO,SOLICITUD_DESCARGA,,,RO,,,various,,,10,,,32312,,,323120,,,Section month security a.,,,available,,voice,,,,FUERA_DE_SERVICIO,,FUERA_DE_SERVICIO,,,,4,,9,,,,6816ad9504ea5839aa7eaaa2
6816ad9504ea5839aa7eadc3,Require local of yet standard.,35493,5666.94,2025-05-03 18:58:13,2025-06-27 18:58:13,ATRASADO,SOLICITUD_CARGA,,,CG,,,quality,,,1,,,29826,,,29826,,,Offer energy environmental.,,,place,,,,,,EN_MANTENIMIENTO,,,,,,6,,,,,,6816ad9504ea5839aa7eaaa3
6816ad9504ea5839aa7eadc4,Guess statement painting win coach store.,435822,69585.03,2025-05-03 18:58:13,2025-06-29 18:58:13,PENDIENTE,SOLICITUD_CARGA,,,CG,,,peace,,,9,,,40693,,,366237,,,Require factor fight.,,,against,,live,,,,EN_MANTENIMIENTO,,DISPONIBLE,,,,10,,7,,,,6816ad9504ea5839aa7eaaa4
6816ad9504ea5839aa7eadc5,Whole center price half likely leave.,205556,32819.84,2025-05-03 18:58:13,2025-06-28 18:58:13,CANCELADO,SOLICITUD_DESCARGA,,,LQ,,,protect,,,4,,,43184,,,172736,,,See maybe series already water.,,,Congress,,with,,,,EN_USO,,EN_MANTENIMIENTO,,,,7,,1,,,,6816ad9504ea5839aa7eaaa5
6816ad9504ea5839aa7eadc6,Mention well officer adult someone.,544308,86906.38,2025-05-03 18:58:13,2025-06-12 18:58:13,ATRASADO,SOLICITUD_DESCARGA,SOLICITUD_CARGA,SOLICITUD_DESCARGA,LQ,GS,GL,find,create,question,6,9,2,26459,24330,39839,158754,218970,79678,Act management project miss rate.,Staff so have military night less hold contain.,Be quickly two allow moment time much mention.,each,former,around,nature,,,FUERA_DE_SERVICIO,EN_MANTENIMIENTO,EN_USO,DISPONIBLE,,,6,3,8,6,,,6816ad9504ea5839aa7eaaa6
6816ad9504ea5839aa7eadc7,Contain long wall traditional for.,482751,77077.87,2025-05-03 18:58:13,2025-06-23 18:58:13,PAGADA,SOLICITUD_CARGA,SOLICITUD_CARGA,SOLICITUD_DESCARGA,GS,CN,LQ,small,source,owner,2,10,3,35863,29927,11559,71726,299270,34677,Idea voice serve image type summer environment.,Pm building simply resource who poor.,Place college necessary lawyer show.,need,measure,,their,eat,,EN_MANTENIMIENTO,EN_USO,,EN_MANTENIMIENTO,EN_MANTENIMIENTO,,5,4,,7,4,,6816ad9504ea5839aa7eaaa7
6816ad9504ea5839aa7eadc8,Exactly less along head yourself else.,523902,83648.26,2025-05-03 18:58:13,2025-06-11 18:58:13,PENDIENTE,SOLICITUD_DESCARGA,SOLICITUD_CARGA,,CN,LQ,,program,continue,,9,1,,47507,12691,,427563,12691,,Score treat interview place front enter.,Affect prevent job father full week quality.,,reveal,seat,,,child,,DISPONIBLE,DISPONIBLE,,,EN_MANTENIMIENTO,,10,8,,,6,,6816ad9504ea5839aa7eaaa8
6816ad9504ea5839aa7eadc9,Or safe between read meeting moment leg any.,148193,23661.08,2025-05-03 18:58:13,2025-06-14 18:58:13,ATRASADO,SOLICITUD_DESCARGA,,,LQ,,,citizen,,,4,,,31133,,,124532,,,Woman year against exactly front.,,,matter,,stuff,,,,EN_MANTENIMIENTO,,DISPONIBLE,,,,10,,1,,,,6816ad9504ea5839aa7eaaa9
6816ad9504ea5839aa7eadca,Kid simple evening matter.,543797,86824.68,2025-05-03 18:58:13,2025-06-09 18:58:13,ATRASADO,SOLICITUD_DESCARGA,SOLICITUD_CARGA,SOLICITUD_CARGA,GS,RO,GL,make,call,rich,8,6,6,26754,14761,25729,214032,88566,154374,Executive use story team.,Church play use street success what only service.,New subject must film term enter ask establish.,senior,week,land,interesting,,little,FUERA_DE_SERVICIO,EN_MANTENIMIENTO,EN_MANTENIMIENTO,FUERA_DE_SERVICIO,,EN_MANTENIMIENTO,5,9,6,2,,3,6816ad9504ea5839aa7eaaaa
6816ad9504ea5839aa7eadcb,Science item view culture of positive moment.,308998,49335.78,2025-05-03 18:58:13,2025-06-02 18:58:13,CANCELADO,SOLICITUD_CARGA,,,RO,,,practice,,,6,,,43277,,,259662,,,Rest newspaper compare impact enter serious center.,,,conference,,,,,,EN_MANTENIMIENTO,,,,,,4,,,,,,6816ad9504ea5839aa7eaaab
6816ad9504ea5839aa7eadcc,Build seat purpose with become than there.,780538,124623.66,2025-05-03 18:58:13,2025-06-09 18:58:13,PENDIENTE,SOLICITUD_DESCARGA,SOLICITUD_DESCARGA,SOLICITUD_DESCARGA,RO,CN,RO,house,action,live,7,5,6,46654,14980,42406,326578,74900,254436,Other once commercial former.,Mission someone for guess approach we enough.,Star test could movement.,establish,view,force,cultural,,,DISPONIBLE,EN_MANTENIMIENTO,DISPONIBLE,DISPONIBLE,,,4,1,9,10,,,6816ad9504ea5839aa7eaaac
6816ad9504ea5839aa7eadcd,Future manage fund believe husband leave.,435961,69607.26,2025-05-03 18:58:13,2025-06-05 18:58:13,PENDIENTE,SOLICITUD_CARGA,SOLICITUD_DESCARGA,SOLICITUD_CARGA,GL,LQ,LQ,series,of,information,4,3,9,24603,17443,23957,98412,52329,215613,Discuss memory TV thus sign change our.,Analysis national sure debate free window political would.,Send dream carry affect police hope trial open.,notice,kitchen,he,sense,role,resource,FUERA_DE_SERVICIO,EN_USO,EN_MANTENIMIENTO,FUERA_DE_SERVICIO,EN_MANTENIMIENTO,EN_MANTENIMIENTO,2,9,5,6,6,8,6816ad9504ea5839aa7eaaad
6816ad9504ea5839aa7eadce,Become common capital.,309375,49396.01,2025-05-03 18:58:13,2025-06-11 18:58:13,PAGADA,SOLICITUD_CARGA,SOLICITUD_DESCARGA,,CN,CN,,government,some,,8,3,,19861,33697,,158888,101091,,Note less hour share.,His bed education serious common.,,four,message,fact,,light,,EN_USO,EN_MANTENIMIENTO,EN_USO,,FUERA_DE_SERVICIO,,1,6,2,,8,,6816ad9504ea5839aa7eaaae
6816ad9504ea5839aa7eadcf,Man issue every be miss party deal movie.,40222,6422,2025-05-03 18:58:13,2025-06-27 18:58:13,PAGADA,SOLICITUD_DESCARGA,,,CN,,,industry,,,2,,,16900,,,33800,,,Brother project employee about.,,,ground,,trouble,,,,EN_USO,,EN_MANTENIMIENTO,,,,8,,7,,,,6816ad9504ea5839aa7eaaaf
6816ad9504ea5839aa7eadd0,Either old push great wife paper.,995492,158944.12,2025-05-03 18:58:13,2025-06-03 18:58:13,ATRASADO,SOLICITUD_CARGA,SOLICITUD_DESCARGA,SOLICITUD_CARGA,GS,GL,RO,reveal,suffer,catch,10,8,9,21025,42528,31786,210250,340224,286074,Want affect mind candidate inside something.,Mrs past issue.,Imagine station cell also.,sit,data,,few,,,EN_MANTENIMIENTO,EN_USO,,DISPONIBLE,,,10,2,,6,,,6816ad9504ea5839aa7eaab0
6816ad9504ea5839aa7eadd1,Information owner factor daughter far cup.,429295,68542.88,2025-05-03 18:58:13,2025-06-02 18:58:13,ATRASADO,SOLICITUD_DESCARGA,SOLICITUD_DESCARGA,SOLICITUD_CARGA,GL,GL,CN,everybody,single,resource,1,10,1,29778,28468,46294,29778,284680,46294,Worker according sometimes between.,Artist even certainly least weight body rest buy.,Serious month story rock run.,we,partner,,TV,size,thus,EN_USO,EN_USO,,EN_MANTENIMIENTO,FUERA_DE_SERVICIO,DISPONIBLE,5,5,,6,2,9,6816ad9504ea5839aa7eaab1
6816ad9504ea5839aa7eadd2,Truth research staff their level.,561957,89724.27,2025-05-03 18:58:13,2025-06-26 18:58:13,ATRASADO,SOLICITUD_DESCARGA,SOLICITUD_DESCARGA,,GS,CG,,bar,recently,,7,9,,16617,39546,,116319,355914,,Head city trip plant process.,Address hope brother east leg world about.,,prepare,life,character,,,,DISPONIBLE,EN_MANTENIMIENTO,FUERA_DE_SERVICIO,,,,10,2,1,,,,6816ad9504ea5839aa7eaab2
6816ad9504ea5839aa7eadd3,Push young natural despite indicate.,482408,77023.15,2025-05-03 18:58:13,2025-06-19 18:58:13,ATRASADO,SOLICITUD_CARGA,SOLICITUD_DESCARGA,SOLICITUD_CARGA,GL,RO,CN,room,air,matter,5,7,5,21092,14405,39818,105460,100835,199090,Seven attorney radio.,Hotel seven charge second.,Member player almost this.,crime,protect,star,our,,training,DISPONIBLE,DISPONIBLE,DISPONIBLE,EN_USO,,FUERA_DE_SERVICIO,2,5,9,8,,4,6816ad9504ea5839aa7eaab3
6816ad9504ea5839aa7eadd4,Bit by five card say poor bank.,397754,63506.93,2025-05-03 18:58:13,2025-06-12 18:58:13,ATRASADO,SOLICITUD_DESCARGA,SOLICITUD_CARGA,SOLICITUD_DESCARGA,GS,GS,GL,risk,president,impact,4,2,5,25139,39113,31093,100556,78226,155465,Hair government onto anyone else.,Wind law keep past book player focus.,Economy why yet read strong personal.,travel,from,,control,,mission,EN_MANTENIMIENTO,DISPONIBLE,,FUERA_DE_SERVICIO,,EN_USO,6,6,,7,,9,6816ad9504ea5839aa7eaab4
6816ad9504ea5839aa7eadd5,Wonder language social up.,149554,23878.44,2025-05-03 18:58:13,2025-06-03 18:58:13,PENDIENTE,SOLICITUD_DESCARGA,SOLICITUD_CARGA,,CG,RO,,explain,old,,1,4,,41860,20954,,41860,83816,,Serve figure right expect hot read prepare.,Choose since positive behind.,,own,star,,,,,EN_USO,EN_USO,,,,,2,1,,,,,6816ad9504ea5839aa7eaab5
6816ad9504ea5839aa7eadd6,Oil able major theory inside way while sure.,240705,38431.87,2025-05-03 18:58:13,2025-06-19 18:58:13,CANCELADO,SOLICITUD_CARGA,SOLICITUD_DESCARGA,SOLICITUD_CARGA,CG,CN,GL,page,describe,similar,1,4,9,30722,12056,13703,30722,48224,123327,Will now risk nice military.,Her on Republican player very eight.,Cold position design born.,I,rock,,into,reality,,EN_USO,EN_USO,,DISPONIBLE,FUERA_DE_SERVICIO,,9,2,,6,5,,6816ad9504ea5839aa7eaab6
6816ad9504ea5839aa7eadd7,Finish lead blood toward son floor.,343849,54900.31,2025-05-03 18:58:13,2025-06-30 18:58:13,PENDIENTE,SOLICITUD_CARGA,SOLICITUD_CARGA,,CG,GL,,answer,population,,1,8,,16789,34020,,16789,272160,,Idea goal performance beat parent political reach deal.,Interest which know camera population agree head.,,year,stage,night,,,,DISPONIBLE,DISPONIBLE,FUERA_DE_SERVICIO,,,,9,9,7,,,,6816ad9504ea5839aa7eaab7
6816ad9504ea5839aa7eadd8,Police edge far lawyer economy.,1072946,171310.65,2025-05-03 18:58:13,2025-06-09 18:58:13,PAGADA,SOLICITUD_CARGA,SOLICITUD_CARGA,SOLICITUD_DESCARGA,GL,GS,CN,generation,minute,development,10,5,6,47216,27191,48920,472160,135955,293520,Continue yard action end officer suffer thousand.,Street economy cost hand far seven.,Material difference contain expert.,audience,memory,scientist,score,security,,DISPONIBLE,FUERA_DE_SERVICIO,DISPONIBLE,FUERA_DE_SERVICIO,FUERA_DE_SERVICIO,,3,4,9,9,10,,6816ad9504ea5839aa7eaab8
6816ad9504ea5839aa7eadd9,Mrs wide method cover bring service.,111461,17796.35,2025-05-03 18:58:13,2025-06-14 18:58:13,CANCELADO,SOLICITUD_CARGA,SOLICITUD_CARGA,,GL,GL,,investment,type,,1,4,,20121,18386,,20121,73544,,Authority reflect learn later president.,Significant left but three ago professional yes federal.,,prevent,everyone,,,,,DISPONIBLE,FUERA_DE_SERVICIO,,,,,1,3,,,,,6816ad9504ea5839aa7eaab9
6816ad9504ea5839aa7eadda,Man early material.,272558,43517.6,2025-05-03 18:58:13,2025-06-21 18:58:13,ATRASADO,SOLICITUD_CARGA,,,LQ,,,season,,,8,,,28630,,,229040,,,Career several above really into.,,,pay,,,,,,EN_USO,,,,,,1,,,,,,6816ad9504ea5839aa7eaaba
6816ad9504ea5839aa7eaddb,Total affect phone condition.,185376,29597.82,2025-05-03 18:58:13,2025-06-13 18:58:13,CANCELADO,SOLICITUD_CARGA,SOLICITUD_CARGA,SOLICITUD_CARGA,GS,CN,CN,painting,from,activity,1,2,2,39132,11173,47150,39132,22346,94300,Blue well how themselves question.,Same management visit night few.,Then nothing machine end partner responsibility.,sport,next,want,play,along,,FUERA_DE_SERVICIO,EN_USO,FUERA_DE_SERVICIO,EN_MANTENIMIENTO,FUERA_DE_SERVICIO,,10,8,8,6,9,,6816ad9504ea5839aa7eaabb
6816ad9504ea5839aa7eaddc,Your staff huge reveal soon clear carry.,310076,49507.92,2025-05-03 18:58:13,2025-06-14 18:58:13,PAGADA,SOLICITUD_DESCARGA,SOLICITUD_DESCARGA,,GS,CN,,follow,high,,2,4,,30824,49730,,61648,198920,,Best American manage herself morning car would almost.,Energy return seek her many long across.,,join,reason,pretty,,move,,EN_MANTENIMIENTO,DISPONIBLE,DISPONIBLE,,FUERA_DE_SERVICIO,,2,4,9,,3,,6816ad9504ea5839aa7eaabc
6816ad9504ea5839aa7eaddd,Daughter system million unit space.,96329,15380.31,2025-05-03 18:58:13,2025-06-29 18:58:13,PAGADA,SOLICITUD_CARGA,,,CG,,,focus,,,3,,,26983,,,80949,,,Gun place yourself degree.,,,section,,consider,,,,FUERA_DE_SERVICIO,,EN_MANTENIMIENTO,,,,4,,2,,,,6816ad9504ea5839aa7eaabd
6816ad9504ea5839aa7eadde,Pressure color four public that expect.,269825,43081.36,2025-05-03 18:58:13,2025-06-27 18:58:13,ATRASADO,SOLICITUD_CARGA,,,LQ,,,cover,,,7,,,32392,,,226744,,,When religious happy establish.,,,cultural,,already,,,,DISPONIBLE,,EN_MANTENIMIENTO,,,,6,,8,,,,6816ad9504ea5839aa7eaabe
6816ad9504ea5839aa7eaddf,Own now store.,103942,16595.74,2025-05-03 18:58:13,2025-06-13 18:58:13,PAGADA,SOLICITUD_DESCARGA,,,LQ,,,behind,,,7,,,12478,,,87346,,,Art pick around stage discover your.,,,among,,blood,,,,FUERA_DE_SERVICIO,,EN_USO,,,,9,,10,,,,6816ad9504ea5839aa7eaabf
6816ad9504ea5839aa7eade0,During by people will.,725529,115840.72,2025-05-03 18:58:13,2025-06-09 18:58:13,ATRASADO,SOLICITUD_DESCARGA,SOLICITUD_CARGA,SOLICITUD_CARGA,LQ,GL,GS,again,store,building,10,1,6,45984,32698,19525,459840,32698,117150,Collection way although heavy wife.,Decide deal make step style.,Side again million young.,wind,agreement,run,sea,,,EN_USO,EN_MANTENIMIENTO,FUERA_DE_SERVICIO,DISPONIBLE,,,9,2,9,3,,,6816ad9504ea5839aa7eaac0
6816ad9504ea5839aa7eade1,Make street vote kid.,376652,60137.66,2025-05-03 18:58:13,2025-06-03 18:58:13,CANCELADO,SOLICITUD_CARGA,SOLICITUD_DESCARGA,SOLICITUD_DESCARGA,CN,CN,CG,eight,lay,everyone,5,2,6,16842,18511,32547,84210,37022,195282,Left five subject result above base.,Above task cause she industry cold buy.,Run her themselves rest science human town.,station,seven,how,picture,,,FUERA_DE_SERVICIO,EN_MANTENIMIENTO,EN_USO,FUERA_DE_SERVICIO,,,1,7,5,3,,,6816ad9504ea5839aa7eaac1
6816ad9504ea5839aa7eade2,About senior create material work.,592294,94567.94,2025-05-03 18:58:13,2025-06-04 18:58:13,PAGADA,SOLICITUD_CARGA,SOLICITUD_CARGA,SOLICITUD_CARGA,CN,GS,LQ,great,not,evidence,6,1,4,49489,30452,42585,296934,30452,170340,Remember be analysis window.,Soldier benefit attention save agreement may.,Actually image line glass majority explain degree.,exist,mind,instead,big,,step,DISPONIBLE,EN_MANTENIMIENTO,EN_MANTENIMIENTO,FUERA_DE_SERVICIO,,EN_MANTENIMIENTO,2,1,2,9,,6,6816ad9504ea5839aa7eaac2
6816ad9504ea5839aa7eade3,Culture off point me.,288736,46100.65,2025-05-03 18:58:13,2025-06-25 18:58:13,PENDIENTE,SOLICITUD_CARGA,,,LQ,,,face,,,5,,,48527,,,242635,,,Language help father car especially.,,,answer,,raise,,,,DISPONIBLE,,EN_MANTENIMIENTO,,,,8,,6,,,,6816ad9504ea5839aa7eaac3
6816ad9504ea5839aa7eade4,Issue animal tend spring bit despite some.,573925,91635.1,2025-05-03 18:58:13,2025-06-14 18:58:13,PENDIENTE,SOLICITUD_DESCARGA,SOLICITUD_DESCARGA,SOLICITUD_DESCARGA,GL,LQ,RO,everyone,east,trouble,5,4,4,36466,32728,42262,182330,130912,169048,Power apply maintain president edge capital.,Lot adult often guess.,Tough draw finally matter hospital challenge base.,beautiful,positive,,stock,,,FUERA_DE_SERVICIO,EN_MANTENIMIENTO,,EN_MANTENIMIENTO,,,7,9,,4,,,6816ad9504ea5839aa7eaac4
6816ad9504ea5839aa7eade5,Anyone improve sport reach back head local.,738426,117899.94,2025-05-03 18:58:13,2025-06-18 18:58:13,ATRASADO,SOLICITUD_DESCARGA,SOLICITUD_CARGA,,GL,GL,,fact,put,,10,9,,27588,38294,,275880,344646,,Business great candidate rule note role many.,Leave history likely item help.,,no,hospital,,,appear,,FUERA_DE_SERVICIO,EN_MANTENIMIENTO,,,EN_USO,,3,2,,,6,,6816ad9504ea5839aa7eaac5
6816ad9504ea5839aa7eade6,Hundred my white of tree author.,694986,110964.18,2025-05-03 18:58:13,2025-06-20 18:58:13,CANCELADO,SOLICITUD_CARGA,SOLICITUD_DESCARGA,,GS,LQ,,different,tell,,3,10,,29604,49521,,88812,495210,,Service everything personal early.,Practice past serious address.,,stuff,way,debate,,,,EN_MANTENIMIENTO,DISPONIBLE,FUERA_DE_SERVICIO,,,,7,1,5,,,,6816ad9504ea5839aa7eaac6
6816ad9504ea5839aa7eade7,Doctor standard receive tell from growth.,794062,126783.01,2025-05-03 18:58:13,2025-06-05 18:58:13,ATRASADO,SOLICITUD_CARGA,SOLICITUD_DESCARGA,SOLICITUD_CARGA,CN,CG,LQ,five,training,dream,1,10,4,26557,48293,39448,26557,482930,157792,Nature far dinner quite economy us population.,Many my age night style author store.,Source environment garden assume system hit serve movie.,heart,if,,fear,marriage,,FUERA_DE_SERVICIO,FUERA_DE_SERVICIO,,FUERA_DE_SERVICIO,EN_USO,,3,6,,10,5,,6816ad9504ea5839aa7eaac7
6816ad9504ea5839aa7eade8,Involve usually painting analysis minute dog.,40341,6441,2025-05-03 18:58:13,2025-06-13 18:58:13,ATRASADO,SOLICITUD_DESCARGA,,,CG,,,phone,,,1,,,33900,,,33900,,,Anything almost easy build.,,,large,,structure,,,,EN_MANTENIMIENTO,,EN_MANTENIMIENTO,,,,6,,9,,,,6816ad9504ea5839aa7eaac8
6816ad9504ea5839aa7eade9,Write ago crime executive improve song half.,328066,52380.34,2025-05-03 18:58:13,2025-06-13 18:58:13,PENDIENTE,SOLICITUD_DESCARGA,SOLICITUD_CARGA,SOLICITUD_CARGA,LQ,RO,CG,live,town,factor,6,4,4,10057,42530,11306,60342,170120,45224,Site bed animal crime rather air couple.,To public word.,As run something sure current short least.,environmental,military,scene,usually,,school,EN_USO,EN_MANTENIMIENTO,FUERA_DE_SERVICIO,EN_MANTENIMIENTO,,EN_MANTENIMIENTO,2,6,7,2,,6,6816ad9504ea5839aa7eaac9
6816ad9504ea5839aa7eadea,Same during though treatment north financial.,282558,45114.36,2025-05-03 18:58:13,2025-06-07 18:58:13,PAGADA,SOLICITUD_DESCARGA,SOLICITUD_CARGA,,GL,CG,,election,daughter,,6,2,,24062,46536,,144372,93072,,Show again well production.,Ability skill beyond actually occur.,,tough,us,,,evidence,,EN_USO,FUERA_DE_SERVICIO,,,DISPONIBLE,,10,5,,,1,,6816ad9504ea5839aa7eaaca
6816ad9504ea5839aa7eadeb,Much blood model old father coach anyone occur.,215354,34384.3,2025-05-03 18:58:13,2025-06-04 18:58:13,ATRASADO,SOLICITUD_CARGA,,,CG,,,figure,,,5,,,36194,,,180970,,,Huge piece family sister either sign live care.,,,song,,,,,,EN_MANTENIMIENTO,,,,,,1,,,,,,6816ad9504ea5839aa7eaacb
6816ad9504ea5839aa7eadec,Week maybe recent until mother fish future.,761850,121639.9,2025-05-03 18:58:13,2025-06-03 18:58:13,CANCELADO,SOLICITUD_CARGA,SOLICITUD_DESCARGA,SOLICITUD_CARGA,CN,CN,CG,hope,wait,commercial,5,7,10,13550,44410,26159,67750,310870,261590,Simple politics speak.,Lay middle floor at.,Affect join actually ability.,land,good,,than,,front,FUERA_DE_SERVICIO,DISPONIBLE,,DISPONIBLE,,DISPONIBLE,2,2,,9,,1,6816ad9504ea5839aa7eaacc
6816ad9504ea5839aa7eaded,Far friend notice raise simple commercial effort source.,240637,38421.04,2025-05-03 18:58:13,2025-06-30 18:58:13,CANCELADO,SOLICITUD_DESCARGA,,,CG,,,manage,,,8,,,25277,,,202216,,,Theory purpose tax pay manager pick whether newspaper.,,,guess,,,,,,FUERA_DE_SERVICIO,,,,,,4,,,,,,6816ad9504ea5839aa7eaacd
6816ad9504ea5839aa7eadee,Commercial often nice month.,54692,8732.4,2025-05-03 18:58:13,2025-06-24 18:58:13,ATRASADO,SOLICITUD_CARGA,,,RO,,,candidate,,,2,,,22980,,,45960,,,Crime trouble economy middle condition positive piece.,,,market,,two,,,,EN_USO,,EN_MANTENIMIENTO,,,,2,,7,,,,6816ad9504ea5839aa7eaace
6816ad9504ea5839aa7eadef,American who coach.,282230,45061.92,2025-05-03 18:58:13,2025-06-17 18:58:13,ATRASADO,SOLICITUD_CARGA,,,GS,,,accept,,,6,,,39528,,,237168,,,Use kind professional own ask company almost mission.,,,three,,,,,,DISPONIBLE,,,,,,3,,,,,,6816ad9504ea5839aa7eaacf
6816ad9504ea5839aa7eadf0,Bed heavy attention.,281271,44908.78,2025-05-03 18:58:13,2025-06-09 18:58:13,PENDIENTE,SOLICITUD_CARGA,SOLICITUD_CARGA,,LQ,LQ,,know,cost,,6,4,,22889,24757,,137334,99028,,Main life yourself stay.,Congress lose tough cup single stand.,,southern,probably,,,,,EN_USO,EN_MANTENIMIENTO,,,,,9,7,,,,,6816ad9504ea5839aa7eaad0
6816ad9504ea5839aa7eadf1,Difference part difficult pay edge media heavy.,416437,66489.93,2025-05-03 18:58:13,2025-06-11 18:58:13,ATRASADO,SOLICITUD_CARGA,,,CN,,,hotel,,,9,,,38883,,,349947,,,Open us model idea.,,,religious,,,,,,DISPONIBLE,,,,,,9,,,,,,6816ad9504ea5839aa7eaad1
6816ad9504ea5839aa7eadf2,Professor growth far.,644871,102962.52,2025-05-03 18:58:13,2025-06-10 18:58:13,CANCELADO,SOLICITUD_CARGA,SOLICITUD_CARGA,,LQ,CG,,work,human,,8,7,,31482,41436,,251856,290052,,Summer fall another company.,Skill professor she smile article hold crime.,,beautiful,memory,,,,,FUERA_DE_SERVICIO,EN_MANTENIMIENTO,,,,,8,3,,,,,6816ad9504ea5839aa7eaad2
6816ad9504ea5839aa7eadf3,Easy true program even heart face.,156973,25062.9,2025-05-03 18:58:13,2025-06-14 18:58:13,PAGADA,SOLICITUD_DESCARGA,,,GS,,,such,,,6,,,21985,,,131910,,,Gun project with here wear camera fast.,,,want,,,,,,EN_MANTENIMIENTO,,,,,,1,,,,,,6816ad9504ea5839aa7eaad3
6816ad9504ea5839aa7eadf4,Source show ground statement Mrs.,888817,141911.95,2025-05-03 18:58:13,2025-06-27 18:58:13,CANCELADO,SOLICITUD_DESCARGA,SOLICITUD_DESCARGA,,GS,RO,,discuss,executive,,9,8,,49897,37229,,449073,297832,,Everyone nearly mouth board.,Discover threat assume.,,energy,staff,Congress,,,,EN_USO,DISPONIBLE,EN_MANTENIMIENTO,,,,1,2,9,,,,6816ad9504ea5839aa7eaad4
6816ad9504ea5839aa7eadf5,Almost station night painting open quickly.,585197,93434.78,2025-05-03 18:58:13,2025-06-07 18:58:13,CANCELADO,SOLICITUD_CARGA,SOLICITUD_CARGA,SOLICITUD_CARGA,RO,CN,GS,teacher,letter,example,2,3,8,45641,15616,44204,91282,46848,353632,Despite check husband effect crime church experience.,Data if ok.,Win we white century according.,media,management,,tax,,,EN_USO,EN_MANTENIMIENTO,,EN_MANTENIMIENTO,,,4,7,,1,,,6816ad9504ea5839aa7eaad5
6816ad9504ea5839aa7eadf6,Nature care meeting chair specific.,654861,104557.57,2025-05-03 18:58:13,2025-06-08 18:58:13,PAGADA,SOLICITUD_CARGA,SOLICITUD_CARGA,SOLICITUD_CARGA,GS,GS,GL,be,senior,can,10,1,2,46067,46403,21615,460670,46403,43230,Choice challenge rise.,Figure red price expect east beyond.,Including floor necessary administration speak religious view.,pay,military,develop,become,ball,station,EN_USO,FUERA_DE_SERVICIO,EN_USO,DISPONIBLE,EN_USO,FUERA_DE_SERVICIO,8,7,1,1,6,9,6816ad9504ea5839aa7eaad6
6816ad9504ea5839aa7eadf7,Center country number source rule study relationship.,361077,57650.94,2025-05-03 18:58:13,2025-06-09 18:58:13,CANCELADO,SOLICITUD_CARGA,,,CN,,,main,,,9,,,33714,,,303426,,,Stuff song board want determine black should.,,,beautiful,,see,,,,EN_USO,,EN_USO,,,,6,,6,,,,6816ad9504ea5839aa7eaad7
6816ad9504ea5839aa7eadf8,Fish defense continue.,59062,9430.08,2025-05-03 18:58:13,2025-06-17 18:58:13,PAGADA,SOLICITUD_DESCARGA,,,GL,,,collection,,,2,,,24816,,,49632,,,Car in thus speak.,,,oil,,other,,,,FUERA_DE_SERVICIO,,DISPONIBLE,,,,5,,2,,,,6816ad9504ea5839aa7eaad8
6816ad9504ea5839aa7eadf9,Two bit real oil.,796212,127126.34,2025-05-03 18:58:13,2025-06-07 18:58:13,PENDIENTE,SOLICITUD_DESCARGA,SOLICITUD_DESCARGA,SOLICITUD_CARGA,RO,LQ,CG,study,season,medical,4,9,10,22734,24890,35414,90936,224010,354140,Red north price.,Yet teacher task best speak threat.,Purpose natural soldier tell.,bed,similar,,change,,door,DISPONIBLE,DISPONIBLE,,EN_MANTENIMIENTO,,FUERA_DE_SERVICIO,4,5,,6,,6,6816ad9504ea5839aa7eaad9
6816ad9504ea5839aa7eadfa,Despite magazine mission television company score six.,181932,29047.96,2025-05-03 18:58:13,2025-06-26 18:58:13,PENDIENTE,SOLICITUD_DESCARGA,,,LQ,,,deep,,,4,,,38221,,,152884,,,His policy begin impact drop third.,,,you,,politics,,,,EN_USO,,DISPONIBLE,,,,6,,6,,,,6816ad9504ea5839aa7eaada
6816ad9504ea5839aa7eadfb,Peace various practice item rich break true.,344908,55069.41,2025-05-03 18:58:13,2025-06-23 18:58:13,PENDIENTE,SOLICITUD_CARGA,SOLICITUD_CARGA,SOLICITUD_DESCARGA,CG,CG,CN,through,eat,probably,5,5,8,23692,15919,11473,118460,79595,91784,Machine consumer health reach successful opportunity computer.,Enter to right.,Future year company teach.,middle,example,,author,,discuss,EN_USO,FUERA_DE_SERVICIO,,DISPONIBLE,,EN_MANTENIMIENTO,3,8,,4,,2,6816ad9504ea5839aa7eaadb
6816ad9504ea5839aa7eadfc,Into money suddenly skin activity there here instead.,190041,30342.62,2025-05-03 18:58:13,2025-06-11 18:58:13,PAGADA,SOLICITUD_CARGA,,,RO,,,attorney,,,7,,,22814,,,159698,,,Best rise what likely power receive measure.,,,available,,,,,,EN_MANTENIMIENTO,,,,,,8,,,,,,6816ad9504ea5839aa7eaadc
6816ad9504ea5839aa7eadfd,Gun language product when visit popular.,309636,49437.62,2025-05-03 18:58:13,2025-06-19 18:58:13,CANCELADO,SOLICITUD_DESCARGA,SOLICITUD_CARGA,,RO,LQ,,from,beyond,,5,2,,40884,27889,,204420,55778,,Shoulder much high west church inside.,Past be center take animal dinner close focus.,,let,piece,pass,,group,,EN_USO,EN_MANTENIMIENTO,EN_MANTENIMIENTO,,DISPONIBLE,,2,7,3,,2,,6816ad9504ea5839aa7eaadd
6816ad9504ea5839aa7eadfe,Including some section central common affect call.,430258,68696.59,2025-05-03 18:58:13,2025-07-02 18:58:13,PENDIENTE,SOLICITUD_CARGA,SOLICITUD_DESCARGA,SOLICITUD_CARGA,GL,GL,GS,pull,arm,region,1,8,9,26898,23609,16199,26898,188872,145791,Forward lot interesting.,Entire trial if push ready cultural citizen house.,Affect assume issue office see.,expect,lot,,watch,idea,however,FUERA_DE_SERVICIO,FUERA_DE_SERVICIO,,EN_MANTENIMIENTO,EN_MANTENIMIENTO,EN_MANTENIMIENTO,7,9,,2,6,5,6816ad9504ea5839aa7eaade
6816ad9504ea5839aa7eadff,Hair end push significant.,572989,91485.57,2025-05-03 18:58:13,2025-06-28 18:58:13,PENDIENTE,SOLICITUD_DESCARGA,SOLICITUD_DESCARGA,SOLICITUD_CARGA,CG,GS,GL,American,appear,between,3,10,5,36456,16699,41029,109368,166990,205145,Throughout friend heart throughout blood.,Indicate job camera including smile me.,Wait support someone concern official memory make manager.,act,long,culture,hope,buy,firm,DISPONIBLE,FUERA_DE_SERVICIO,EN_USO,EN_MANTENIMIENTO,EN_MANTENIMIENTO,EN_MANTENIMIENTO,5,4,9,4,7,8,6816ad9504ea5839aa7eaadf
6816ad9504ea5839aa7eae00,Rich many Republican discuss down.,989309,157956.88,2025-05-03 18:58:13,2025-06-08 18:58:13,ATRASADO,SOLICITUD_CARGA,SOLICITUD_CARGA,SOLICITUD_CARGA,LQ,RO,CG,big,bill,claim,3,8,10,38058,33321,45061,114174,266568,450610,Nice decide usually enjoy always own another.,Skin likely recent.,It especially practice evidence value explain rock.,they,personal,would,majority,,,FUERA_DE_SERVICIO,EN_USO,DISPONIBLE,EN_MANTENIMIENTO,,,2,5,9,3,,,6816ad9504ea5839aa7eaae0
